regime,valeur réelle,valeur prédite
"Let’s go en cuisine pour préparer ces paninis façon fajitas au boeuf! Imprimer Épingler la recette Paninis façon fajitas au boeuf Temps de préparation15 minutes min Temps de cuisson15 minutes min Type de plat: Plat principalCuisine: Mexicaine Mots-clés: boeuf, cheddar, crème épaisse, épices mexicaines, guacamole, panini, poivrons rouges Portions: 4 Matériel nécessaireAppareil à croque-monsieur (ou à paninis) Ingrédients 1 petit oignon rouge1/2 poivron rouge1 filet d'huile d'olive250 g de viande hachée de boeuf 1 bonne cs de concentré de tomateépices mexicaines, sel (à doser selon les goûts)4 pains à panini4 cc de crème fraîche épaisse4 cc de guacamole4 tranches de cheddar InstructionsPeler et émincer l'oignon. Peler (ou pas) le poivron et le tailler en petits dés.Dans une poêle, faire chauffer l'huile d'olive et y faire revenir les légumes quelques minutes.Ajouter la viande et bien mélanger pour la détacher en miettes. Laisser cuire jusqu'à ce qu'elle ne soit plus rouge.Ajouter le concentré de tomates, les épices et saler. Bien mélanger.Faire chauffer l'appareil à croque monsieur.Ouvrir les pains à panini et tartiner la base de crème. Napper la partie supérieure de guacamole.Répartir la garniture au boeuf sur chaque base puis déposer une tranche de cheddar. Refermer avec la partie supérieure.Faire chauffer les paninis dans l'appareil pendant 2-3 min, jusqu'à ce que le fromage soit bien fondu.Servir aussitôt avec une salade verte.",0,0
"Ingrédients Pour 12 bouchées 4 feuilles de riz 12 feuilles de menthe fraîche 4 morceaux de saumon frais carottes râpées fromage de chèvre frais pousses de soja la sauce 2 cuillère(s) à soupe de sauce soja 2 cuillère(s) à soupe d'huile de sésame 1 cuillère(s) à soupe de vinaigre de riz 1/2 gousse d'ail râpée 1 cuillère(s) à café de gingembre râpé 1 cuillère(s) à café de graines de sésame noir Préparation Faites tremper une feuille de riz jusqu’à ce qu’elle ramollisse, égouttez-la. Posez sur un côté de la feuille de riz 3 feuilles de menthe, un morceau de saumon, de la carotte râpée, du chèvre frais, et quelques pousses de soja. Rabattez un côté de la feuille de riz sur la préparation, puis le deuxième côté et la partie basse. Enroulez le tout en serrant assez fort. Coupez le rouleau en 3 bouchées. Renouvelez l’opération pour les autres rouleaux de printemps. Mélangez tous les ingrédients de la sauce. Servez avec les bouchées.",0,0
"Ingrédients 300 g de speculoos 80 g de beurre 250 g de mascarpone très froid 15 cl de crème liquide entière très froide 1 cuillère(s) à café d'extrait de vanille 30 g de sucre glace 500 g de fraises IGP du Périgord Préparation Mixez les biscuits pour obtenir une poudre, puis ajoutez le beurre fondu et mélangez bien. Tassez la préparation dans le fond d’un cercle ou dans un moule anti-adhésif avec fond amovible, puis réservez 15 mn au réfrigérateur. Fouettez vivement le mascarpone avec la crème et la vanille, puis ajoutez le sucre lorsque la crème commence à prendre. Continuez à fouetter jusqu’à obtenir une consistance bien ferme. Réservez au frais. Rincez les fraises, équeutez-les et coupez-les en deux dans la longueur. Garnissez le fond de tarte d’une couche de crème à l’aide d’une poche à douille ou simplement avec une spatule, puis disposez les fraises en les « plantant » dans la crème. Servez bien frais.",0,0
"Ingrédients 1 cuillère à soupe d' huile d'olive 200 g de saumon / personne 1 citron vert 2 cuillères à soupe de soja ciboulette fraîche Voir plus Voir moins En cliquant sur les liens, vous pouvez être redirigé vers d’autres pages de notre site, ou sur Amazon.fr La suite après cette publicité Ustensiles 1 couteau Top 3 des couteaux + de détails 1 bol Top des saladiers + de détails 1 paire de ciseaux Les meilleurs ciseaux de cuisine + de détails 1 dénoyauteur Les meilleures ventes Acheter 1 Réfrigérateur Notre top des mini réfrigérateurs + de détails Voir plus Voir moins En cliquant sur les liens, vous pouvez être redirigé vers d’autres pages de notre site, ou sur Amazon.fr Préparation Temps total : 15 min Préparation : 15 min Repos : - Cuisson : - Étape 1 Emincer très finement le saumon (pavé sans peau et sans arêtes), puis mettre au réfrigérateur. Étape 2 Préparer dans un bol : le jus du citron vert, la sauce au soja , et l'huile d'olive. Étape 3 Dans un autre bol, ciseler la ciboulette fraîche. Juste au moment de servir, mettre la sauce sur le saumon ainsi que la ciboulette. Étape 4 Servir avec des pousses de soja et un riz sauvage. e emmy_17594495",0,0
"Ingrédients : Pour 4 personnes 500 g de litchis frais ou au sirop (j’ai pris des frais) 1 mangue 400 g environ 50 g de sucre glace 2 feuilles de gélatine ou 2 g d’agar agar 1 pincée de vanille en poudre 1 c à s de sucre en poudre. Le jus d 1/2 citron 10 cl de crème fleurette à 30 % Physalis pour la déco Préparation des mousses mangue litchi Préparation : 20 mn Pause au froid : 4h . Mousse de de mangue • Pelez la mangue, retirez le noyau et coupez-la en morceaux. • Mixez les morceaux avec le sucre glace. • Faites chauffer le jus de citron avec l’agar agar ou les feuilles de gélatine • que vous aurez réhydratées dans un peu d’eau et ajoutez-le au coulis de mangue. • Montez la crème en crème fouettée et incorporez-la délicatement au mélange. • Versez dans des verrines et laissez au réfrigérateur un minimum de 2 heures. . Crème de litchi • Épluchez les litchis (ou égouttez les si vous avez pris des litchis en conserve). • Mixez-les. • Ajoutez le sucre et la vanille. • Au moment de servir, recouvrez les mousses de mangue de cette crème de litchi. • Saupoudrez d’un peu de vanille en poudre.",0,0
"Ingrédients Pour la pâte à pancakes 200 g d'oeufs 50 g de sucre 1 g de fleur de sel écrasé 120 g de farine T55 180 g de lait entier Pour la garniture 2 bananes coupées en deux 1 fruit de la passion 1 gousse de vanille beurre clarifié Préparation Préparez la pâte à pancakes : battez les œufs avec le sucre et la fleur de sel. Ajoutez la farine, mélangez, puis incorporez lait. Laissez reposer 30 mn. Placez un plat en fonte au four à 205°/th. 7. Quand il est chaud, sortez-le, laissez fondre une noix de beurre, puis versez la pâte dans le plat. Replacez au four aussitôt et laissez cuire 8 mn. Faites rôtir les bananes dans un peu de beurre clarifié avec la gousse de vanille coupée en deux dans la longueur, laissez dorer, puis déglacez avec la pulpe d’un fruit de la passion. Disposez sur le dutch baby pancake et servez chaud.",0,0
"Ingrédients : Pour 4 personnes 1 saucisson à cuire 1 kg de pomme de terre 1 carotte 1 oignon 1 bouquet garni 1 verre à moutarde de vin blanc sec 2 échalotes 3 càs de vinaigre de vin vieux 3 càs d’huile de noix 3 càs d’huile d’arachide Sel & poivre Préparation 1.Piquer le saucisson pour qu’il n’éclate pas pendant la cuisson. Le mettre à cuire dans une eau frémissante avec la carotte, l’oignon, le bouquet garni, du sel et du poivre. Laisser cuire entre 30 et 40 min. 2.Pendant ce temps, éplucher les pomme de terre, couper les en rondelles et les faire cuire à l’eau salée. Une fois cuite les égoutter. 3.Préparer la vinaigrette composée de vin blanc, de vinaigre et des deux huiles, de sel et de poivre. Ajouter les échalotes finement hachées. 4.Après avoir égoutté le saucisson disposer le sur un plat entourée des pommes de terre encore tiède nappées de la sauce vinaigrette.",0,0
"Ingrédients : Pour 6 personnes 2 belles aubergines 15cl huile d’olive 1 oignon haché 2 d’ail finement hachées 1càs farine 500g agneau maigre haché 1 boîte tomates concassées 3 tomates fraîches en tranches 1càs d’origan 1càs de thym Sel & poivre du moulin Garniture : 20cl yaourts nature 2 oeufs 25g feta émiettée 25g parmesan râpé Préparation de la moussaka • Préchauffez le four à 180°C • Coupez les aubergines en tranches minces et les disposer dans une passoire. • Saupoudrez-les de sel pour les faire dégorger et ce pendant 30 min puis bien les essuyer. • Dans une cocotte chauffer 3 c à s d’huile d’olive et • Faire revenir l’ail et l’oignon puis • Ajoutez l’agneau et laisser cuire à feu vif en remuant jusqu’à ce qu’il soit doré. • Incorporez la farine, les tomates concassées, l’origan et le thym, assaisonner. • Portez à ébullition et laisser frémir 20 min. • Pendant ce temps dans une autre grande poêle faites chauffer l’huile et • Faites dorer les tranches d’aubergines une à une. Réserver. • Dans un grand plat à gratin disposez la moitié des aubergines puis la moitié des tomates fraîches, • Ajoutez la moitié du hachis puis recouvrez du restes des aubergines et des tomates, • Terminez par le hachis. • Battez les œufs avec le yaourt et ajoutez la fêta et le parmesan. • Versez ce mélange sur la viande et l’étaler de façon uniforme. • Mettez au four pendant 35-40 min, le dessus doit être légèrement doré et bouillonnant. . À déguster avec un bon verre de vin rosé très frais. .",0,0
"Ingrédients 2 pâtes feuilletées la crème amande/chocolat au lait/passion 190 g de chocolat au lait 5 fruits de la passion 100 g de beurre demi-sel ramolli 20 g de cassonade 2 oeufs 100 g de poudre d'amande 10 g de farine Pour décorer 1 jaune d'oeuf 1 cuillère(s) à soupe de lait 50 g de chocolat au lait fruits de la passion Préparation Préchauffez le four à 200 °C/th. 6-7. Faites fondre 130 g de chocolat au lait. Hachez le reste en morceaux. Prélevez la chair des fruits de la Passion, puis passez-la au chinois pour recueillir le jus. Mélangez le beurre, la cassonade, les œufs, la poudre d’amande, la farine, le chocolat au lait fondu, le jus de Passion et les pépites de chocolat. Réservez. Étalez les pâtes feuilletées, découpez-y deux cercles de 27 cm de diamètre. Conservez les chutes pour une autre utilisation. Étalez la crème d’amande sur une première pâte feuilletée jusqu’à 2 cm du bord, placez la fève. Humidifiez le pourtour avec de l’eau. Recouvrez le tout de la deuxième pâte feuilletée. Appuyez sur tout le pourtour pour sceller les pâtes ensemble. Mélangez le jaune d’œuf et le lait. Badigeonnez-en le dessus de la galette, tracez des motifs à l’aide d’un couteau. Percez un petit trou au centre de la galette et aux quatre points cardinaux. Enfournez-la pendant 30 mn. Faites fondre le chocolat au lait et versez-le sur le dessus de la galette. Servez avec des fruits de la Passion coupés en deux.",0,0
"Let’s go en cuisine pour préparer ce risotto au poulet et pesto! Imprimer Épingler la recette 5 de 7 votes Risotto au poulet et pesto Temps de préparation10 minutes min Temps de cuisson20 minutes min Type de plat: Plat principalCuisine: Italienne Mots-clés: pesto, poulet, risotto, riz, tomates séchées Portions: 4 Matériel nécessaireThermomix Ingrédients 350 g de blancs de poulet1 filet d'huile d'olive (celle du pot de tomates séchées)1 oignon50 g de tomates séchées300 g de riz carnaroli (ou arborio)50 g de vin blanc700 g d'eau bouillante1 cube de bouillon de volailledu pesto alla genovese InstructionsTailler les blancs de poulet en petits cubes et les faire dorer dans une poêle dans un peu d'huile des tomates séchées. Couvrir puis laisser cuire quelques minutes à feu doux. Saler et poivrer.Dans le bol du thermomix, placer l'oignon pelé et coupé en 4 avec les tomates séchées et mixer 5 sec à vitesse 5.Ajouter 2 cs d'huile des tomates séchées et faire rissoler 3 min à 120°, vitesse 1.Ajouter le riz et le faire nacrer 2 min à 120°, sans inverse, vitesse 1.Ajouter le vin blanc et cuire 1 min à 120°, sens inverse, vitesse 1.Ajouter l'eau et le cube de bouillon émietté puis mélanger avec la spatule.Faire cuire 14 min à 100°, sens inverse, vitesse 1.A la fin de la cuisson, ajouter les cubes de poulet dans le bol et mélanger avec la spatule.Laisser reposer 4-5 min. Servir le risotto accompagné de pesto et de parmesan râpé. Notes:Sans thermomix, réaliser toutes les étapes de la même façon dans une sauteuse (il faudra au préalable émincer l'oignon et tailler les tomates en petits dés). Le bouillon doit être ajouté louche après louche (en attendant qu'il soit absorbé avant d'en rajouter de nouveau) et il faut mélanger régulièrement pour une cuisson homogène.En utilisant l'huile des tomates séchées, le plat est encore plus parfumé. Si vous ne consommez pas d'alcool, remplacez-le par la même quantité de bouillon.",0,0
"Let’s go en cuisine pour préparer ce filet de poisson au pesto de persil et pistaches! Imprimer Épingler la recette 5 de 1 vote Filet de poisson au pesto de persil et pistache Temps de préparation10 minutes min Temps de cuisson25 minutes min Type de plat: Plat principal Mots-clés: citron, lieu noir, persil, pistaches, poisson, pommes de terre Portions: 4 Ingrédients 800 g de pommes de terre grenaille1 filet d'huile d'olivesel, poivre500 g de filets de lieu noir (ou autre poisson blanc)50 g de pistaches décortiquées1 gousse d'ail1 petite botte de persille jus d'1 citron6 cs d'huile d'olive InstructionsPréchauffer le four à 220° (chaleur tournante).Laver les pommes sans les éplucher et les couper en 2 ou 4 selon la taille.Les déposer sur une plaque allant au four, arroser d'un filet d'huile, saler et poivrer. Mélanger pour bien les enrober.Enfourner et laisser cuire 25 min.Pendant ce temps, saler et poivrer les filets de poisson.Réduire les pistaches en poudre et en répartir la moitié sur le poisson.Déposer les filets sur la plaque à côté des pommes de terre et faire cuire 10 min.Pendant ce temps, mixer l'ail avec le persil effeuillé, le jus de citron, l'huile d'olive, 2-3 cs d'eau, le reste de poudre de pistaches, du sel et du poivre. Servir les filets de poisson avec les pommes de terre dorées et le pesto.",0,0
"Let’s go en cuisine pour préparer ce banana bread noix et chocolat! Imprimer Épingler la recette 5 de 2 votes Banana bread noix et chocolat Temps de préparation10 minutes min Temps de cuisson50 minutes min Type de plat: Goûter, Petit déjeuner Mots-clés: bananes, noix, pépites de chocolat Matériel nécessairemoule à cake Ingrédients 80 g de noix4 bananes2 oeufs50 g de sucre complet50 g d'huile de coco170 g de farine1 sachet de levure chimique20 g de lait100 g de pépites de chocolat InstructionsPréchauffer le four à 180° (chaleur tournante).Dans le bol du thermomix, réduire les noix en poudre en 3 coups de turbo. Réserver dans un bol.Sans rincer le bol, mixer grossièrement 3 bananes.Ajouter le reste des ingrédients, y compris les noix en poudre (sauf les pépites de chocolat) et mélanger 30 sec à vitesse 4.Racler les parois du bol avec une spatule et mélanger de nouveau 15 sec à vitesse 4.Ajouter les pépites de chocolat dans le bol et mélanger en sens inverse 10 sec.Verser la préparation dans un moule à cake (beurré et fariné si nécessaire).Découper la dernière banane en deux dans la longueur et la déposer sur la pâte.Enfourner et laisser cuire 45 à 50 min.Laisser tiédir avant de démouler puis laisser refroidir complètement sur une grille.Notes:Sans thermomix, écraser les bananes avec une fourchette dans un saladier pus ajouter le reste des ingrédients en mélangeant bien entre chaque ajout.",0,0
"Ingrédients 500 g de fraises 1 concombre 1 tomate ananas 1 tomate green zebra 1 tomate noire de crimée 1 boule de scamorza (fromage italien fumé) 1 branche de basilic 20 g de roquette 3 cuillère(s) à café de vinaigre balsamique 4 cuillère(s) à soupe d'huile d'olive vierge extra sel, poivre Préparation Rincez, équeutez et coupez les fraises en deux. Épluchez le concombre et taillez-le en fines rondelles. Rincez les tomates, coupez-les en tranches très fines puis disposez-les sur chaque assiette. Coupez la scamorza en fins copeaux. Rincez et ciselez le basilic. Mélangez délicatement les fraises, le concombre et le basilic. Assaisonnez de 1 cuil. à soupe d’huile d’olive et poivrez. Disposez le tout au centre du carpaccio de tomates et parsemez de copeaux de scamorza. Rincez et séchez la roquette. Assaisonnez-la du reste d’huile d’olive et de vinaigre balsamique, salez et dressez sur les assiettes.",0,0
"Version rapide : 1 belle laitue, 20cl de crème légère liquide, 10cl de bouillon de volaille maison ou à défaut un cube tout prêt. Laver la laitue et l’étuver 2 minutes dans le bouillon. La mixer finement avec la cuisson et ajouter 20cl de crème. Passer éventuellement au chinois, garder la purée récupérée pour un autre usage – facultatif- Rectifier l’assaisonnement. Emulsionner au moment de servir avec 1 noisette de beurre. Dresser dans de petits bols ou assiettes creuses. Version plus élaborée : crème de laitue aux légumes: Cuire dans du bouillon de volaille bouillant en les gardant croquants des légumes ou des minis légumes. Carottes, navets, radis noirs, fenouil, céleri rave, topinambours, asperges vertes, pois gourmands, champignons etc. selon la saison et le marché. Egoutter, réserver. Les réchauffer au moment du repas et les ajouter au velouté de laitue. Délicieux avec de la volaille pochée ou du filet de bœuf à la ficelle.",0,0
"Let’s go en cuisine pour préparer ces clafoutis poireaux chorizo! Imprimer Épingler la recette 5 de 1 vote Clafoutis poireaux chorizo à la multidélices Temps de préparation10 minutes min Temps de cuisson45 minutes min Type de plat: Entrée, Plat principal Mots-clés: chorizo, clafoutis, multidélices, parmesan, poireaux Portions: 6 Matériel nécessaireYaourtière Multidélices Ingrédients 1 échalote2 blancs de poireaux1 filet d'huile d'olive20 g de maïzena10 cl de lait2 gros oeufs50 g de parmesan râpésel, poivre40 g de chorizo + 12 rondelles InstructionsEmincer l'échalote pelée et les blancs de poireaux. Chauffer l'huile dans une sauteuse et les faire revenir une dizaine de minutes en mélangeant régulièrement. Saler et poivrer.Dans un saladier, délayer la maïzena dans le lait puis ajouter les oeufs. Bien mélanger avec un fouet.Incorporer le parmesan. Saler (modérément à cause du fromage) et poivrer.Répartir la poêlée de poireaux dans 6 pots de la yaourtière et verser l'appareil aux oeufs dessus.Tailler les 40 g de chorizo en petits morceaux et les répartir également dans les pots.Déposer 2 rondelles de chorizo sur le dessus de chaque clafoutis.Remplir le réservoir de la yaourtière avec de l'eau et placer les pots sur le support.Fermer le couvercle de la multidélices et lancer la cuisson pour 35 min en programme 4 (desserts lactés).Notes:Si vous avez la multidélices 12 pots, n'oubliez pas de boucher les trous restants avec des couvercles.Sans multidélices, cuire 15 min au cookeo dans le panier vapeur ou encore une vingtaine de minutes au four.",0,0
"Ingrédients sel poivre 1 cuillère à soupe de vinaigre balsamique 2 cuillères à soupe d' huile d'olive 0.5 oignon 0.5 poivron rouge 1 boîte de tomates pelées 1 fromage de chèvre frais demi de citron 2 brins de basilic Voir plus Voir moins En cliquant sur les liens, vous pouvez être redirigé vers d’autres pages de notre site, ou sur Amazon.fr La suite après cette publicité Ustensiles 1 Mixeur Les meilleures ventes Acheter 1 bol Top des saladiers + de détails 1 dénoyauteur Les meilleures ventes Acheter En cliquant sur les liens, vous pouvez être redirigé vers d’autres pages de notre site, ou sur Amazon.fr Préparation Temps total : 10 min Préparation : 10 min Repos : - Cuisson : - Étape 1 Epépinez un demi-poivron rouge, épluchez et émincez un demi-oignon. Étape 2 Dans le bol d'un mixeur, mettez les tomates pelées avec leur jus, le poivron, l'oignon, le jus de citron et le vinaigre baslamique. Étape 3 Mixez jusqu'à obtention d'une soupe épaisse. Étape 4 Incorporez l'huile d'olive. Assaisonnez et réservez au frais. Étape 5 Coupez le fromage de chèvre en petits cubes. Étape 6 Au moment de servir, répartissez le gaspacho dans 2 verres, ajoutez les cubes de fromage de chèvre et décorez de feuilles de basilic. j julia_13814541",0,0
"Ingrédients 2 cuillères à soupe d' huile d'olive sel En fonction de vos goûts 4 cuillères à soupe de crème fraîche 1 brin d' aneth bonne pincée de poivre 1 Pavé de saumon 2 cuillères à café de citron Voir plus Voir moins En cliquant sur les liens, vous pouvez être redirigé vers d’autres pages de notre site, ou sur Amazon.fr La suite après cette publicité Préparation Temps total : 3 j 8 h Préparation : 20 h Repos : 2 j 12 h Cuisson : - Étape 1 Hachez les pavés de saumon au couteau en formant des petits cubes. Évitez les gros morceaux car le tartare se tiendrait moins bien. Étape 2 Placez les petits dés de saumon frais dans un saladier ou un bol et ajoutez-y l'huile d'olive et le jus de citron. Assaisonnez à votre convenance en sel et poivre. Recouvrez le saladier de papier film et placez au réfrigérateur pour 1 heure Étape 3 Pendant que le saumon marine au frais, mélangez la crème fraîche avec 2 cuillères à café de jus de citron et l’aneth. Assaisonnez à nouveaux avec du poivre et du sel puis placez au frais. Étape 4 Quelques minutes avant de servir, posez un cercle à pâtisserie sur une assiette et remplissez-le de saumon mariné en pressant avec le dos de la cuillère pour que donner une forme régulière au tartare. Soulevez délicatement le cercle : le tartare doit parfaitement se tenir. Étape 5 Servez le tartare immédiatement avec un peu de sauce. p paijotrrei",0,0
"Ingrédients 1 cuillère à soupe de sucre glace 1 banane 0.5 cuillère à café de vanille 60 g de sucre semoule 3 yaourts au lait entier 200 g de mascarpone 1 kiwi 1 pomme granny 1 citron (pour son jus) Voir plus Voir moins En cliquant sur les liens, vous pouvez être redirigé vers d’autres pages de notre site, ou sur Amazon.fr La suite après cette publicité Ustensiles 1 Fouet cuisine Top 5 des meilleurs fouets Acheter 1 saladier Les meilleures ventes Acheter 1 balance de cuisine Top des meilleures balances + de détails 1 Frigo Top des meilleurs réfrigérateurs + de détails En cliquant sur les liens, vous pouvez être redirigé vers d’autres pages de notre site, ou sur Amazon.fr Préparation Temps total : 15 min Préparation : 15 min Repos : - Cuisson : - Étape 1 Mélangez les yaourts avec le Mascarpone, le sucre, l'essence de vanille dans un saladier. Travaillez au fouet électrique de façon à avoir une préparation onctueuse. Répartissez cette crème dans de beaux verres évasés ou dans des coupes. Mettez-les au réfrigérateur. Étape 2 Pelez le kiwi, coupez-le en petits morceaux. Pelez la pomme et taillez-la en petits dés. Epluchez la banane et découpez-la en fines rondelles. Étape 3 Mélangez les fruits dans une jatte, arrosez-les de jus de citron, saupoudrez de sucre glace et remuez délicatement. Mettez-les au frais. Étape 4 Juste au moment de servir, répartissez la salade de fruits dans les coupes. e eva_14045652",0,0
"Ingrédients Pour 10 pièces la pâte 23 cl de lait 10 g de levure boulangère fraîche 7 cl d'huile de tournesol 400 g de farine 5 g de sel 10 g de sucre la farce 100 g de feta 200 g de halloumi 5 g de persil 5 g de menthe sèche 1 g de poudre d'anis poivre blanc huile de friture Préparation Préparez la pâte. Versez le lait dans une casserole et faites-le tiédir légèrement. Retirez du feu, ajoutez la levure émiettée et laissez reposer 20 mn. Mélangez le lait et l’huile dans la cuve d’un robot pâtissier muni de la feuille, puis ajoutez la farine, le sel et le sucre. Pétrissez pendant 10 mn. Débarrassez et réservez 1 h à température ambiante. Préparez la farce. Coupez les fromages en petits dés. Émincez le persil et la menthe, puis ajoutez l’anis et un peu de poivre blanc. Mélangez le tout et passez la préparation au hachoir. Réservez au réfrigérateur. Étalez la pâte au rouleau à pâtisserie sur un plan de travail fariné pour obtenir une épaisseur de 3 à 4 mm. Détaillez des disques de 10 cm de diamètre. Déposez 1 grosse cuil. à soupe de farce au centre de chaque disque de pâte abaissée, puis refermez en deux et appuyez sur les bords à l’aide d’une fourchette. Faites chauffer un bain d’huile à 180 °C dans une sauteuse et faites frire les chaussons 5 mn, ou faites-les cuire au four 20 mn à 180 °C.",0,0
"Ingrédients 1 boule de céleri-rave 50 g de soba (sarrasin grillé) 1 g de safran 150 g de beurre quelques pousses de shiso quelques pétales de souci sel, poivre Préparation Lavez et épluchez le céleri-rave. Coupez quatre tranches de 3 cm d’épaisseur. Faites cuire, dans une poêle, les tranches de céleri avec le beurre moussant et le safran en les arrosant copieusement de jus pendant 10 mn. Plantez la pointe d’un couteau pour vérifier la cuisson. Le céleri doit être cuit à cœur mais avecencore un peu de résistance. Quand il est bien coloré et cuit à point, débarrassez-le, salez, poivrez et lustrez-le (recouvrez-le) avec le beurre de cuisson. Déposez dans une assiette plate une tranche de céleri et saupoudrez de soba. Décorez avec de jeunes pousses de shiso vert et des pétales de souci.",0,0
