regime,valeur réelle,valeur prédite
VRAIS POSITIFS, , 
"Ingrédients 2 cuillères à soupe d' huile d'olive 1 cuillère à soupe d' huile de sésame 50 g de sucre roux 2 cuillères à soupe de vinaigre balsamique 250 g de tempeh 3 cuillères à soupe de sauce soja 1 tasse (5 cl) de jus de citron Voir plus Voir moins En cliquant sur les liens, vous pouvez être redirigé vers d’autres pages de notre site, ou sur Amazon.fr La suite après cette publicité Ustensiles 1 Set 3 poêles Notre sélection des meilleures poêles + de détails 1 planche à découper Top des meilleures planches à découper + de détails En cliquant sur les liens, vous pouvez être redirigé vers d’autres pages de notre site, ou sur Amazon.fr Préparation Temps total : Préparation : - Repos : - Cuisson : - Étape 1 Préparer la marinade en mélangeant tous les ingrédients ensemble (sauf le tempeh). Étape 2 Découper le tempeh en dès. Ajouter les morceaux dans la marinade. Étape 3 Laisser mariner 2h au frais. Étape 4 Verser la préparation dans une poêle et ajouter un peu d'eau. Laisser cuire 15 minutes. Étape 5 Retourner plusieurs fois le tempeh pendant la cuisson pour que chaque côté caramélise. M Marmiton_Recettes",1,1
"Ingrédients 1 cuillère à soupe de sésame 1 bonne pincée de sel 1 cuillère à café de sucre 1 cuillère à café de levure de boulanger sèche 2 cuillères à soupe d' huile d'olive 150 g de farine 9 cl de lait d'avoine pour la garniture poivre sel 3 cuillères à soupe d' huile d'olive 0.5 chou-fleur 20 g de chou rouge 8 feuilles de laitue Pour la sauce 1 pincée de piment facultatif 1 cuillère à café rase de curry doux 3 cuillères à soupe de crème de coco Voir plus Voir moins En cliquant sur les liens, vous pouvez être redirigé vers d’autres pages de notre site, ou sur Amazon.fr La suite après cette publicité Ustensiles 1 saladier Les meilleures ventes Acheter 1 Couteau Top des meilleurs couteaux de cuisine + de détails 1 Four Top des meilleurs fours + de détails 1 Top des meilleures plaques à four plaque à four + de détails 1 papier sulfurisé papier sulfurisé + de détails 1 Top des meilleures plaques a four Plaque à four + de détails 1 balance de cuisine Top des meilleures balances + de détails Voir plus Voir moins En cliquant sur les liens, vous pouvez être redirigé vers d’autres pages de notre site, ou sur Amazon.fr Préparation Temps total : 4h30 Préparation : 40 min Repos : 2h10 Cuisson : 1h40 Étape 1 Commencer par préparer les buns : mettre la levure dans le lait légèrement tiédi pendant 10 minutes. Étape 2 Dans un saladier, mélanger la farine avec le sel et le sucre. Creuser un puits au centre et y verser le lait avec la levure et l'huile. Mélanger et pétrir jusqu'à obtention d'une pâte homogène. Étape 3 Mettre en boule, recouvrir d'un torchon et laisser pousser 2h à température ambiante (dans une pièce chaude ou près d'un radiateur s'il fait froid). Étape 4 Dégazer la pâte en enfonçant le poing dedans puis pétrir la pâte sur un plan de travail fariné. La partager en 4 morceaux égaux, en faire des boules et les aplatir légèrement. Étape 5 Les laisser pousser à nouveau, recouverts d'un torchon pendant 40 minutes. Étape 6 Préchauffer le four à 200°C (thermostat 6-7). Disposer les boules sur une plaque recouverte de papier cuisson. Les humidifier légèrement avec du lait végétal ou de l'eau et saupoudrer de graines de sésame. Faire une croix sur le dessus des buns avec un couteau si vous le souhaitez. Enfourner pour 20 minutes de cuisson et laisser refroidir sur une grille à la sortie du four. Étape 7 Pour la garniture : détailler le chou-fleur en tranches d'environ 5 mm d'épaisseur. Les répartir sur une plaque à four recouverte de papier cuisson. Huiler et saupoudrer de sel. Étape 8 Enfourner à 200°C (thermostat 6-7) pour 35 à 40 minutes de cuisson. Étape 9 Détailler le chou-rouge en lamelles. Assaisonner ainsi que la laitue de l'huile restante, de sel et de poivre. Étape 10 Préparer la sauce en mélangeant tous les ingrédients. Ajouter un peu d'eau si la sauce est trop épaisse. Étape 11 Monter les burgers : couper en 2 les buns. Disposer un peu de sauce sur les fonds puis le mélange laitue-chou-rouge. Recouvrir de chou-fleur rôti puis du reste de la sauce. Fermer les burgers et déguster. M Marmiton_Recettes",1,1
"Ingrédients 6 poivrons de couleurs différentes 1 gousse d'ail 2 cuillère(s) à soupe d'huile d'olive 1 cuillère(s) à café de cumin en poudre 1 cuillère(s) à café de harissa 2 cuillère(s) à soupe de miel liquide 1 cuillère(s) à soupe de jus de citron 4 cuillère(s) à soupe de bouillon de légumes en poudre 4 tiges d'origan effeuillées 4 grandes tranches de pain grillé sel et poivre Préparation Rincez et coupez les poivrons en deux. Enlevez les graines et les pédoncules, et détaillez-les en lanières. Pelez et hachez l’ail. Faites chauffer à feu moyen l’huile d’olive dans une grande poêle. Ajoutez les poivrons et faites-les revenir une douzaine de minutes tout en remuant régulièrement, jusqu’à ce qu’ils ramollissent et dorent. Ajoutez l’ail, le cumin, la harissa, le miel, le jus de citron, le bouillon de légumes et l’origan. Salez, poivrez et remuez bien le tout. Prolongez la cuisson jusqu’à ce que les poivrons soient enrobés d’une sauce épaisse. Servez sans attendre sur le pain grillé.",1,1
"Ingrédients 3 cuillères à soupe d' huile 1 butternut Voir plus Voir moins En cliquant sur les liens, vous pouvez être redirigé vers d’autres pages de notre site, ou sur Amazon.fr La suite après cette publicité Ustensiles 1 friteuse + de détails 1 Four top des meilleurs fours + de détails 1 couteau Top 3 des couteaux + de détails 1 économe Top 5 des meilleurs économe + de détails 1 saladier Les meilleures ventes Acheter 1 Cuillère en bois Les meilleures ventes Acheter Voir plus Voir moins En cliquant sur les liens, vous pouvez être redirigé vers d’autres pages de notre site, ou sur Amazon.fr Préparation Temps total : 50 min Préparation : 5 min Repos : - Cuisson : 45 min Étape 1 Préchauffer le four à 210°C (thermostat 7). Étape 2 Vider la courge et la peler (c'est l'étape la plus difficile; personnellement je la débite en plusieurs morceaux avant de l'éplucher avec un couteau bien aiguisé). Étape 3 Couper des petits tronçons (style mini-frites). Étape 4 Mettre les bâtonnets de courge dans un saladier, verser les 3 cuillères d'huile. Ajouter du sel, du poivre et du paprika doux pour obtenir un aspect proche des potatoes. Étape 5 Bien mélanger. Étape 6 Cuire les frites 45 minutes sur une lèche-frites, en les retournant régulièrement. l lapinette34",1,1
"Ingrédients Pour les crudités : 1 carotte 1 avocat 1 endive 0.25 chou rouge 1 échalote douce Pour la sauce : 1 pincée de poivre 1 pincée de sel 1.5 cuillère à soupe d' huile de de noisette 1.5 cuillère à soupe d' huile de sésame 1 cuillère à soupe de vinaigre de vin rouge 1 cuillère à café de moutarde à l'ancienne Voir plus Voir moins En cliquant sur les liens, vous pouvez être redirigé vers d’autres pages de notre site, ou sur Amazon.fr La suite après cette publicité Ustensiles 1 Râpe Top des meilleures râpes + de détails 1 couteau Top 3 des couteaux + de détails 1 paire de ciseaux Les meilleurs ciseaux de cuisine + de détails 1 Cuillère en bois Les meilleures ventes Acheter En cliquant sur les liens, vous pouvez être redirigé vers d’autres pages de notre site, ou sur Amazon.fr Préparation Temps total : 15 min Préparation : 15 min Repos : - Cuisson : - Étape 1 Râper les carottes, couper le chou rouge en très fines lamelles. Étape 2 Couper l'endive et couper l'avocat en cube et ciseler l'échalote. Étape 3 Pour la sauce, mélanger la moutarde et le vinaigre, ajouter petit à petit l'huile jusqu'à obtenir une sauce bien homogène. Étape 4 Ajouter le sel et poivre. Étape 5 Mélanger le tout et savourer cette salade fraiche, colorée, pleine de vitamines ! m mia_17375229",1,1
"Ingrédients 250 g de petits pois 200 g de pois gourmands 200 g d'edamame 500 g d'asperges vertes 200 g de tofu fumé (facultatif) 2 avocats 1 citron 100 g de pousses d'épinards 5 g de graines de sésame 2 cuillère(s) à soupe d'huile de sésame Pour la sauce 1 avocat 1 petit piment vert 10 cl de lait de coco 2 cuillère(s) à soupe de sauce soja 1 cuillère(s) à soupe de jus de citron 1 bouquet d'herbes fraîches (estragon, coriandre persil plat) Préparation Faites cuire 10 mn les petits pois dans un grand volume d’eau salée. 5 mn avant la fin de la cuisson, ajoutez les edamame, puis égouttez le tout, passez-les sous l’eau très froide afin de conserver leur jolie couleur verte. Coupez les pieds des asperges, puis les têtes à 6-7 cm et tranchez le restant en petits tronçons. Dans une sauteuse, faites chauffer les asperges et les pois gourmands dans l’huile de sésame bien chaude environ 8 mn jusqu’à ce qu’ils soient dorés et croquants, débarrassez les légumes. Coupez le tofu en petits cubes, puis faites-le dorer dans la même poêle. Pelez et coupez les avocats en petits cubes. Pressez le citron et arrosez les dés d’avocat pour éviter qu’ils ne s’oxydent. Dans un saladier, mélangez les légumes, ajoutez les pousses d’épinards et les dés de tofu. Parsemez de graines de sésame. Préparez la sauce verte : dans le bol d’un mixeur, mettez l’avocat pelé et coupés en cubes ainsi que le piment épépiné (selon votre goût), puis ajoutez le lait de coco, la sauce soja et le jus de citron, mixez pour obtenir une texture bien lisse. Ajoutez ensuite votre bouquet d’herbes fraîches effeuillées et mixez à nouveau. Ajustez l’assaisonnement en sel et en poivre. Servez la salade avec la sauce.",1,1
"Ingrédients 300 g de carottes 2 oignons 350 g de lentilles corail coriandre moulue curcuma moulu cumin moulu gingembre moulu noix de muscade moulue 500 g de tomates pelées en conserve bouillon de légumes feuilles de coriandre sel, poivre du moulin huile d'olive graines de sésame feuilles de cerfeuil Préparation Pelez les carottes et coupez-les en rondelles. Pelez et émincez les oignons. Rincez les lentilles corail. Versez dans une casserole 2 cuil. à soupe d’huile d’olive, ajoutez les oignons et faites cuire 5 mn à feu moyen, jusqu’à ce qu’ils soient translucides. Ajoutez les carottes, 1 cuil. à café de coriandre, 1 cuil. à soupe de curcuma, 1 cuil. à soupe de cumin, 2 cuil. à café de gingembre et 1 cuil. à café de noix de muscade. Poursuivez la cuisson pendant 5 mn. Incorporez les lentilles corail, les tomates pelées avec leur jus et 1,6 l de bouillon. Portez à ébullition, baissez le feu, puis laissez mijoter 20 mn à feu doux. Ajoutez quelques feuilles de coriandre et mélangez. Versez la préparation dans le bol d’un blender puis mixez jusqu’à obtenir une texture lisse et homogène. Salez, poivrez. Versez la soupe dans des bols, saupoudrez de graines de sésame et de feuilles de cerfeuil.",1,1
"Ingrédients gousse de vanille en moulin (à volonté) 6 cuillères à soupe de miel liquide 1 poignée de noix (au choix amandes, noix, noisettes, personnellement j’opte pour des noix du Brésil) 250 g d' avoine 40 g de noix de coco 5 cl d' eau 3 cuillères à café d' huile de coco Voir plus Voir moins En cliquant sur les liens, vous pouvez être redirigé vers d’autres pages de notre site, ou sur Amazon.fr La suite après cette publicité Ustensiles 1 Four Top des meilleurs fours + de détails 1 casserole Top 3 des batteries de casseroles + de détails 1 Rouleau à pâtisserie Top des meilleurs rouleaux à pâtisserie + de détails 1 saladier Les meilleures ventes Acheter 1 Cuillère en bois Les meilleures ventes Acheter 1 Top des meilleurs papiers sulfurisés Papier sulfurisé + de détails 1 Couvercle Les meilleures ventes Acheter Voir plus Voir moins En cliquant sur les liens, vous pouvez être redirigé vers d’autres pages de notre site, ou sur Amazon.fr Préparation Temps total : 30 min Préparation : 10 min Repos : - Cuisson : 20 min Étape 1 Sortir la plaque du four et préchauffer le four à 150°C (thermostat 5). Étape 2 Pendant ce temps, faire fondre l’huile de coco dans une petite casserole avec l’eau, le miel et quelques tours de moulin à vanille. Étape 3 Casser les noix en gros morceaux en les mettant dans un petit sac congélation et en les écrasant légèrement avec un rouleau à pâtisserie. Les verser avec les flocons d’avoine dans un saladier. Étape 4 Verser le mélange miel/eau sur la préparation flocons d’avoine/noix et bien mélanger. Laisser le mélange reposer quelques minutes afin que les flocons d’avoines gonflent. Étape 5 Couvrir la plaque du four de papier sulfurisé et y étaler la préparation de manière uniforme sur toute la surface. Étape 6 Enfourner à mi-hauteur pour 20 min et sortir la plaque du four lorsque tous les flocons ont pris une couleur dorée (au bout de 5 min environ) et les mélanger pour les répartir de nouveau sur toute la plaque. Cela permet aux flocons de cuire de façon homogène. Étape 7 Renouveler l’opération et mélanger de nouveau une fois avant la fin de la cuisson. Étape 8 Sortir le granola du four et le laisser refroidir. Conserver dans un bocal étanche ou bien une boîte plastique hermétique. Étape 9 A déguster avec du lait ou du yaourt et agrémenté de fruits de saison. e emmy_16549257",1,1
"Ingrédients 2 cuillères à soupe d' huile d'olive 3 carottes 200 g de chou rouge 1 pomme de type fuji 1 cuillère à soupe de jus de citron sel et poivre ciboulette Voir plus Voir moins En cliquant sur les liens, vous pouvez être redirigé vers d’autres pages de notre site, ou sur Amazon.fr La suite après cette publicité Ustensiles 1 bol Top des saladiers + de détails 1 dénoyauteur Les meilleures ventes Acheter En cliquant sur les liens, vous pouvez être redirigé vers d’autres pages de notre site, ou sur Amazon.fr Préparation Temps total : 20 min Préparation : 20 min Repos : - Cuisson : - Étape 1 Hacher le chou en fines lamelles. Étape 2 Éplucher les carottes et la pomme. Les râper finement. Étape 3 Mélanger le chou rouge, les carottes et la pomme ensemble. Hacher la ciboulette et en parsemer les crudités. Étape 4 Dans un bol, mélanger l'huile d'olive et le jus de citron, saler et poivrer. Servir à côté de la salade pour assaisonner. M Marmiton_Recettes",1,1
"Let’s go en cuisine pour préparer ce poulet sauce citronnée et quinoa tomaté! Imprimer Épingler la recette 5 de 3 votes Poulet sauce citronnée et quinoa tomaté Temps de préparation10 minutes min Temps de cuisson20 minutes min Type de plat: Plat principal Mots-clés: ail, citron, persil, poulet, quinoa Portions: 4 Ingrédients Pour le quinoa:1 oignon rouge1 filet d'huile d'olive1 gousse d'ail70 g de concentré de tomate300 g de quinoa600 ml d'eau1 cube de bouillon de légumesPour le poulet:4 blancs de poulet 1 filet d'huile d'olive + 3 cs2 citrons1 petit bouquet de persilsel, poivre InstructionsPréparer le quinoa:Dans une casserole, faire revenir l’oignon émincé dans l’huile d’olive pendant quelques minutes.Ajouter l’ail écrasé et le concentré de tomate puis bien mélanger.Ajouter le quinoa, l’eau et le cube de bouillon.Laisser cuire à couvert une bonne quinzaine de minutes (en vérifiant régulièrement le niveau de liquide) jusqu’à ce que le quinoa soit bien cuit.Pendant ce temps, faire cuire le poulet.Dans une poêle, faire chauffer un filet d’huile d’olive et faire dorer les filets de poulet sur toutes les faces. Saler et poivrer.Baisser le feu et couvrir la poêle, puis poursuivre la cuisson environ 10 min (selon l’épaisseur des filets).Pendant ce temps, râper finement le zeste d'1 citron au-dessus d’un petit bol.Ajouter le jus des deux citrons, l’huile d’olive restante ainsi que le persil finement ciselé. Saler et poivrer.Servir le poulet en tranches épaisses, arrosé d’huile citronnée avec le quinoa tomaté.",1,1
"Ingrédients sucre roux eau de fleur d'oranger 2 bananes 2 oranges 12 fraises 2 kiwis 2 pommes autres fruits selon les goûts, pamplemousse, figues, ananas... Voir plus Voir moins En cliquant sur les liens, vous pouvez être redirigé vers d’autres pages de notre site, ou sur Amazon.fr La suite après cette publicité Ustensiles 1 Couteau Top des meilleurs couteaux de cuisine + de détails 1 économe Top 5 des meilleurs économe + de détails 1 Cuillère en bois Les meilleures ventes Acheter 1 balance de cuisine Top des meilleures balances + de détails En cliquant sur les liens, vous pouvez être redirigé vers d’autres pages de notre site, ou sur Amazon.fr Préparation Temps total : 10 min Préparation : 10 min Repos : - Cuisson : - Étape 1 Peler les oranges à vif et les couper en quartiers. Étape 2 Eplucher et couper les bananes et les kiwis en rondelles. Étape 3 Laver et couper les fraises et les pommes en morceaux. Étape 4 Mélanger tous les fruits et les arroser d'eau de fleur d'oranger. Étape 5 Saupoudrer de sucre et réserver au frais 1h avant de servir. N Natacha La suite après cette publicité Découvrez les meilleurs accords mets et vins avec les desserts aux agrumes avec Voir la sélection En partenariat avec Tanin.fr Qu'est-ce qu'on mange ce soir ? De l'inspiration chaque jour avec des recettes faciles, gourmandes et de SAISON :)",1,1
"Ingrédients poivre sel 1.5 concombre 10 feuilles de menthe + 4 petites feuilles pour la décoration 0.5 citron Voir plus Voir moins En cliquant sur les liens, vous pouvez être redirigé vers d’autres pages de notre site, ou sur Amazon.fr La suite après cette publicité Ustensiles 1 Couteau Top des meilleurs couteaux de cuisine + de détails 1 économe Top 5 des meilleurs économe + de détails 1 Mixeur Les meilleures ventes Acheter 1 blender Notre sélection des 5 meilleurs blenders 2021 + de détails 1 Frigo Top des meilleurs réfrigérateurs + de détails Voir plus Voir moins En cliquant sur les liens, vous pouvez être redirigé vers d’autres pages de notre site, ou sur Amazon.fr Préparation Temps total : 15 min Préparation : 15 min Repos : - Cuisson : - Étape 1 Éplucher les concombres. Les couper dans le sens de la longueur et ôter les pépins à l’aide d’une cuillère. Couper les concombre en morceaux. Étape 2 Dans un blender (mixer), mettre les morceaux de concombre, les feuilles de menthe lavées, le jus de citron. Étape 3 Mixer jusqu’à obtention d’un gaspacho onctueux. Goûter, saler et poivrer. Étape 4 Répartir dans 4 verres transparents, décorer avec les petites feuilles de menthe Étape 5 Mettre les préparations au réfrigérateur une 1/2 heure. k kenzo_14600799",1,1
"Ingrédients coriandre fraîche curry 1 tomate , enlever pulpe, hacher chaire 1 piment frais haché (attention au piment, lavez-vous les mains en frottant les ongles une fois haché !) 1 oignon 1 courgette en petits cubes pincée de sel 3 cuillères à soupe d' huile d'olive 200 g de farine bise (ou 50 g de farine complète + 150 g de farine blanche) 200 g de tofu ferme nature en petits cubes 2 gousses d' ail Voir plus Voir moins En cliquant sur les liens, vous pouvez être redirigé vers d’autres pages de notre site, ou sur Amazon.fr La suite après cette publicité Ustensiles 1 saladier Les meilleures ventes Acheter 1 Cuillère en bois Les meilleures ventes Acheter 1 Set 3 poêles Notre sélection des meilleures poêles + de détails 1 couteau Top 3 des couteaux + de détails 1 Rouleau à pâtisserie Top des meilleurs rouleaux à pâtisserie + de détails 1 Four Top des meilleurs fours + de détails 1 fourchette + de détails 1 presse agrume + de détails 1 planche à découper Top des meilleures planches à découper + de détails 1 dénoyauteur Les meilleures ventes Acheter 1 balance de cuisine Top des meilleures balances + de détails Voir plus Voir moins En cliquant sur les liens, vous pouvez être redirigé vers d’autres pages de notre site, ou sur Amazon.fr Préparation Temps total : 1h40 Préparation : 1 h Repos : - Cuisson : 40 min Étape 1 Préparer la pâte : mélanger la farine, le sel et l'huile d'olive jusqu'à obtention mélange sableux. Étape 2 Ajouter graduellement de l'eau (environ 20 cl) jusqu'à pouvoir former une boule lisse. Laisser reposer. Étape 3 Préparer la farce : émincer l'ail et l'oignon, puis les faire revenir avec le piment, puis ajouter tofu et remuer 5 min. Étape 4 Ajouter tomate et courgette, sel, poivre, curry (préférez du curry de madras ou du curry doux, pour résultat plus relevé forcez le piment). Étape 5 Laisser cuire 5 min, les courgettes doivent rester croquantes. Retirez du feu, ajouter coriandre hachée, laisser bien refroidir. Étape 6 Là, ça se complique... :) Pour former des ronds de pâte de 8cm de diamètre, abaisser des petites quantités de pâte pour former des ronds approximativement de la bonne grandeur, puis découper la forme exacte avec un emporte-pièce ou simplement avec un récipient du bon diamètre et un couteau. Étape 7 Répartir la farce dans chaque rond en laissant suffisamment de bords pour pouvoir refermer en pliant en 2. Bien presser les bords ensemble, petits trous à la fourchette sur le dessus. Étape 8 Cuire à four chaud (180 à 200°C) pour éviter que le dessous soit tout mou... 10 min pile, 15 min face, 10 à 15 min dernier tour en badigeonnant légèrement le dessus à l'oeuf. Étape 9 Voilà, faut avoir le temps, pour végétariens patients... Version viande hachée délicieuse aussi cela dit! a agathe_16616940",1,1
"Ingrédients 1 pincée de sel 0.5 sachet de levure chimique 50 g de sucre roux 150 g de farine de blé 12.5 cl de lait d'avoine 7 cl d' huile de pépin de raisin 1 cuillère de zeste de citron Voir plus Voir moins En cliquant sur les liens, vous pouvez être redirigé vers d’autres pages de notre site, ou sur Amazon.fr La suite après cette publicité Ustensiles 1 Four top des meilleurs fours + de détails 1 balance de cuisine Top des meilleures balances + de détails En cliquant sur les liens, vous pouvez être redirigé vers d’autres pages de notre site, ou sur Amazon.fr Préparation Temps total : 1h27 Préparation : 12 min Repos : 1 h Cuisson : 15 min Étape 1 Mélangez les ingrédients secs : farine, sucre, levure et sel. Étape 2 Faites un puits au centre, versez-y l'huile, le lait d'avoine et le zeste de citron. Mélangez jusqu'à obtention d'une pâte lisse. Étape 3 Réserver au froid pendant 1 heure. Étape 4 Préchauffez le four à 240°C (thermostat 8). Remplissez les empreintes à madeleines huilées aux 3/4. Étape 5 Enfournez pour 5 minutes de cuisson puis baissez le four à 200°C (thermostat 6-7) avant de poursuivre la cuisson 10 minutes. M Marmiton_Recettes",1,1
"Let’s go en cuisine pour préparer cette bavette de flanchet au chutney d’oignons! Imprimer Épingler la recette 5 de 6 votes Bavette de flanchet au chutney d’oignons Temps de préparation10 minutes min Temps de cuisson15 minutes min Type de plat: Plat principal Mots-clés: bavette, boeuf, moutarde, oignons, sirop d’érable, viande Portions: 4 Ingrédients 4 bavettes de flanchet1 bel oignon jaune (ou 2 petits)1 filet d'huile d'olive2 cs de vinaigre de cidre1 cs de moutarde40 ml de sirop d'érablesel, poivre InstructionsPréparer le chutney d'oignons:Peler et émincer les oignons.Dans une casserole, les faire revenir dans un filet d'huile d'olive à feu moyen pendant 7-8 min. Déglacer avec le vinaigre puis ajouter la moutarde et le sirop d'érable. Poursuivre la cuisson 2-3 min.Pendant ce temps, faire cuire les bavettes:Dans une poêle, faire chauffer un filet d'olive et saisir les bavettes des deux côtés à feu vif. Baisser un peu le feu et poursuivre la cuisson jusqu'à la cuisson souhaitée. Saler et poivrer.Retirer du feu et conserver les bavettes dans une assiette sous un papier d'aluminium.Déglacer la poêle avec un petit d'eau et gratter les sucs de cuisson pour obtenir un jus.Servir les bavettes nappées et de jus avec le chutney d'oignons. Une autre idée de sauce pour accompagner la bavette: une savoureuse sauce à l’échalote.",1,1
"Ingrédients piment de Cayenne (facultatif) 1 cuillère à soupe d' oignon en poudre 400 g de tofu ferme sel et poivre 1 cuillère à soupe de paprika fumé Pour la panure : piment de Cayenne (facultatif) 30 g de fécule de maïs 20 cl de lait d'avoine (non sucré) chapelure ou flocon d'avoine ou corn-flakes mixés sel et poivre Voir plus Voir moins En cliquant sur les liens, vous pouvez être redirigé vers d’autres pages de notre site, ou sur Amazon.fr La suite après cette publicité Ustensiles 1 Set 3 poêles Notre sélection des meilleures poêles + de détails En cliquant sur les liens, vous pouvez être redirigé vers d’autres pages de notre site, ou sur Amazon.fr Préparation Temps total : 20 min Préparation : 10 min Repos : - Cuisson : 10 min Étape 1 Presser le tofu pour enlever l'eau. L'émietter grossièrement. Étape 2 Mixer le tofu avec le sel, le poivre, le paprika et le piment de Cayenne. Étape 3 Former des nuggets avec la pâte obtenue et laisser reposer 30 minutes au frigo. Étape 4 Assaisonner la chapelure avec le sel, le poivre et le piment si désiré. Étape 5 Mélanger la maïzena et lait d'avoine, le liquide doit être homogène et ne pas faire de grumeaux. Étape 6 Tremper les nuggets de tofu dans le mélange de lait d'avoine et de maïzena et les enrober de chapelure. Étape 7 Faire chauffer de l'huile pour friture dans une poêle. Y faire frire les nuggets jusqu'à obtenir une belle coloration de chaque côté. Les égoutter sur du papier absorbant avant de servir. M Marmiton_Recettes",1,1
