regime,valeur réelle,valeur prédite
"Ingrédients 250 g de patate douce 80 g de farine 50 g de poudre de noisette 50 g de cacao en poudre non sucré 70 g de sucre roux 60 g d' huile de coco 1 cuillère d' arôme vanille Voir plus Voir moins En cliquant sur les liens, vous pouvez être redirigé vers d’autres pages de notre site, ou sur Amazon.fr La suite après cette publicité Ustensiles 1 four + de détails 1 spatule + de détails 1 bol + de détails 1 cuiseur vapeur + de détails En cliquant sur les liens, vous pouvez être redirigé vers d’autres pages de notre site, ou sur Amazon.fr Préparation Temps total : 1 h Préparation : 10 min Repos : - Cuisson : 50 min Étape 1 Épluchez les patates douces, coupez-les en petits cubes et déposez-les dans le panier vapeur. Ajoutez 0,5 L d’eau dans le bol inox, installez le panier vapeur et lancez le programme VAPEUR, 30 minutes. Étape 2 À la fin du programme, videz l’eau du bol inox puis mettez-y la patate douce. Lancez le programme EXPERT, 3 minutes / vitesse 13 (sans chauffer). Étape 3 Préparation du brownie. Préchauffez votre four à 180°C (thermostat 6). Versez tous les ingrédients dans le bol inox puis lancez le programme EXPERT, 2 minutes / Vitesse 8 (sans chauffer). Rabattez la préparation si besoin avec une spatule. Étape 4 Tapissez un moule 20 x 20 cm puis versez-y la préparation. Étape 5 Déposez les noix de pécan sur le dessus. Enfournez 20 minutes selon votre four. Testez la cuisson du gâteau en plongeant un cure-dent : s’il ressort sec, c’est cuit. Étape 6 Au moment de servir, versez un filet de caramel liquide sur le dessus et parsemez de quelques graines de grenade.",0,1
"Ingrédients miel liquide noix 1 yaourt nature 2 cuillères à soupe de pétales de maïs 2 cuillères à soupe de flocons d'avoine graines de courge graines de tournesol raisins secs raisins secs canneberge noisettes Voir plus Voir moins En cliquant sur les liens, vous pouvez être redirigé vers d’autres pages de notre site, ou sur Amazon.fr La suite après cette publicité Ustensiles 1 saladier Les meilleures ventes Acheter En cliquant sur les liens, vous pouvez être redirigé vers d’autres pages de notre site, ou sur Amazon.fr Préparation Temps total : 5 min Préparation : 5 min Repos : - Cuisson : - Étape 1 Dans un saladier, commencer par mettre une cuillère de céréales. Étape 2 Mettre le yaourt par dessus. Étape 3 Enfin, mettre les fruits à coques hachés finement, les fruits secs et quelques graines au centre. Arroser le tout de miel ! M Marmiton_Recettes",0,1
"Ingrédients 100 g de jambon rôti ou de jambon de paris 2 poires 100 g de stilton (ou autre fromage bleu) 200 g de mâche 100 g de cerneaux de noix la vinaigrette 1 cuillère(s) à soupe de miel 3 cuillère(s) à soupe d'huile d'olive 2 cuillère(s) à soupe de moutarde 1 cuillère(s) à soupe de vinaigre de cidre Préparation Coupez le jambon en dés et les poires en fines tranches. Émiettez le stilton. Rincez la mâche. Réunissez le jambon, les poires, le stilton, la mâche et les noix dans un saladier. Préparez la vinaigrette. Mélangez tous les ingrédients et versez sur la salade.",0,1
"La recette: Pour 6 personnes : 1 petit céleri rave, 2 langoustines par personne, 30cl de lait, 15cl de crème fleurette, sel, poivre, Cayenne. Couper le céleri épluché en petits dés et les cuire 20mn environ avec 30cl de lait à couvert. Mixer en ajoutant la crème, assaisonner à convenance. Décortiquer à cru les langoustines, les assaisonner de sel poivre et cayenne, les poêler 1mn à feu vif au moment du service. Les poser sur le velouté chaud et ajouter un filet d’huile de pistache. Pour la version St Jacques, compter 1 grosse noix par personne, émincée en 2 dans l’épaisseur, assaisonnée et poêlée à feu vif une minute. Parsemer le velouté de quelques noisettes concassées et torréfiées 10mn minutes au four, ajouter un filet d’huile de noisettes.",0,1
"Ingrédients 12 amandes de mer 1 citron vert bio 8 cm de concombre bio 1 oignon frais 8 noisettes décortiquées huile d'olive 2 cuillère(s) à café de sauce piquante (type Tabasco) poivre du moulin Préparation Ouvrez les amandes avec un couteau à huîtres et prélevez la chair. Gardez les parties fermes et rincez bien sous l’eau froide. Coupez-les en deux et placez-les dans un bol avec le jus et le zeste du citron vert pendant 30 mn. Lavez et coupez le concombre en dés de 1/2 cm de côté. Pelez et émincez finement l’oignon frais. Hachez finement les noisettes. Mélangez les amandes de mer marinées avec le concombre et du sel. Servez dans des petites assiettes avec l’oignon émincé, arrosez d’un filet d’huile d’olive, ajoutez quelques gouttes de sauce piquante, et servez aussitôt avec un peu de poivre moulu.",0,1
"Let’s go en cuisine pour préparer ces tartines figues et chèvre! Imprimer Épingler la recette 4.75 de 4 votes Tartines figues et chèvre Temps de préparation5 minutes min Temps de cuisson5 minutes min Type de plat: Entrée Mots-clés: bûche de chèvre, chèvre frais, figues, noix, pain Portions: 2 Ingrédients 2 tranches de pain de campagne2 cs de chèvre frais1 belle figue (2 si elles sont petites)2-3 rondelles de bûche de chèvre2-3 noixthymdu miel InstructionsPréchauffer le gril du four à 210°.Passer les tranches de pain au grille-pain (facultatif, mais ça permet au pain d'être bien croustillant) puis les poser les tranches sur une plaque couverte de papier cuisson.Les tartiner de fromage de chèvre frais.Couper la figue en 6 et la répartir sur les tranches.Répartir également les 1/2 rondelles de bûche de chèvre.Saupoudrer de noix concassées et de thym effeuillé.Arroser d'un filet de miel.Passer sous le gril du four environ 5 min, le temps pour le fromage de fondre et à la figue de dorer légèrement.Servir aussitôt nappé d'un petit filet de miel, sur un lit de salade.",0,1
"Ingrédients 1 huile de friture (facultatif) 1 pot de miel 1 pincée de sel 100 g de beurre 400 g de semoule de blé dur moyenne 500 g de pâte de dattes 5 cuillères de café d'eau de fleur d'oranger 1 pincée de cannelle 1 verre d' eau Voir plus Voir moins En cliquant sur les liens, vous pouvez être redirigé vers d’autres pages de notre site, ou sur Amazon.fr La suite après cette publicité Ustensiles 1 Cuillère en bois Les meilleures ventes Acheter 1 Micro-ondes Le top des micro-ondes + de détails 1 Couteau Top des meilleurs couteaux de cuisine + de détails 1 Four Top des meilleurs fours + de détails 1 Top des meilleures plaques à four plaque à four + de détails 1 bol Top des saladiers + de détails 1 balance de cuisine Top des meilleures balances + de détails 1 assiette + de détails Voir plus Voir moins En cliquant sur les liens, vous pouvez être redirigé vers d’autres pages de notre site, ou sur Amazon.fr Préparation Temps total : 55 min Préparation : 15 min Repos : - Cuisson : 40 min Étape 1 Préparer une première pâte avec la semoule, le beurre, le sel, un verre d'eau et 4 cuillerées a café d'eau de fleur d'oranger. Étape 2 Mélanger le tout et rouler la pâte de façon a obtenir un long boudin. Étape 3 Préparer une seconde pâte avec la pâte de dattes, la cannelle et la dernière cuillerée d'eau de fleur d'oranger, passer la au micro-ondes quelques secondes pour qu'elle soit plus malléable. Mélanger et constituer un second boudin. Étape 4 Creuser une tranchée dans la première pâte et y insérer la seconde puis rouler afin de fermer de façon homogène. Couper le boudin obtenu en losanges. Étape 5 Cuisson : laisser cuire au four 5 min à 250°C puis 15 min à 150°C. Étape 6 Ils ressortent toujours blancs alors je les passes quelques secondes dans un bain de friture. Étape 7 Juste après la cuisson faire chauffer 1 min un bol de miel au micro-ondes et tremper chaque losanges dedans sur les 2 faces puis les installer sur une grille pour égoutter le surplus de miel. Étape 8 Laisser refroidir dans une assiette en les séparant bien puis REGALEZ-VOUS ! a anna_16985461",0,1
"Ingrédients Pour la brioche 190 g de beurre doux 7 g de sel 12 g de levure de boulanger fraîche pour 250g de farine 75 g de sucre 650 g de farine T45 3 oeufs 225 g de lait Pour la garniture noix : noisettes, noix de pécan, etc... (facultatif) 30 g de cacao amer 50 g de sucre glace Ingrédient incontournable 130 g de chocolat noir 120 g de beurre doux Pour le sirop 75 g de sucre 75 g d' eau Voir plus Voir moins En cliquant sur les liens, vous pouvez être redirigé vers d’autres pages de notre site, ou sur Amazon.fr La suite après cette publicité Ustensiles 1 robot pâtissier Le top des robots pâtissiers + de détails 1 film alimentaire + de détails 1 Réfrigérateur Notre top des mini réfrigérateurs + de détails 1 cuillère à soupe + de détails 1 couteau Top 3 des couteaux + de détails 1 Four Top des meilleurs fours + de détails 1 papier sulfurisé papier sulfurisé + de détails 1 balance de cuisine Top des meilleures balances + de détails Voir plus Voir moins En cliquant sur les liens, vous pouvez être redirigé vers d’autres pages de notre site, ou sur Amazon.fr Préparation Temps total : 15h30 Préparation : 40 min Repos : 14h10 Cuisson : 40 min Étape 1 On commence par la brioche : mettre tous les ingrédients sauf le beurre dans la cuve du robot et mélanger 10 min à vitesse 2. Attention ne jamais mettre la levure au contact du sel car il casse son action. Mélangez jusqu’à obtention d’une boule homogène qui se décolle des parois. Étape 2 Intégrer le beurre petit à petit jusqu’à incorporation complète. Étape 3 Quand tout le beurre est incorporé, continuer à pétrir pendant 7 à 10 min à vitesse moyenne. La pâte doit se décoller, être homogène, lisse, brillante, souple et être élastique. Racler de temps en temps les bords de la cuve pour faciliter le pétrissage et aider la pâte à se détacher. Étape 4 Poser la pâte sur votre plan de travail et l’étaler avec la paume avant de lui donner 2 ou 3 rabats. Étape 5 Verser la pâte dans un récipient huilé (tournesol), couvrir d’un torchon humide ou filmer et laisser reposer une heure à température ambiante. Étape 6 Poser le pâte sur le plan de travail et le dégazer en l’étirant entre les mains et en l’aplatissant. Elle doit reprendre une forme plate. Étape 7 Mettre le pâton dans un récipient huilé avec de l'huile de tournesol et couvrir d’un film alimentaire et réserver au réfrigérateur pendant 12h. Étape 8 Pour préparer la garniture, faire fondre le beurre doux et le chocolat noir au bain-marie. Étape 9 Ajouter le sucre glace et le cacao en poudre et mélanger. On doit obtenir la consistance d’une pâte à tartiner. Étape 10 Laissez refroidir le chocolat 10 min. Étape 11 Sortez la boule de pâte et déposez-la sur un plan de travail fariné. Au rouleau, abaissez la pâte en un grand rectangle de 1cm de hauteur. Étape 12 Répartissez la garniture de chocolat sur la pâte et rajoutez une cuillère à soupe de sucre en poudre. Ajoutez éventuellement des éclats de noisettes / amandes / noix de pécan... Étape 13 Roulez la pâte sur elle-même dans la largeur en serrant bien pour obtenir un gros rouleau. Étape 14 Coupez le rouleau en 2 dans la longueur. Étape 15 Mettre les deux moitiés ainsi obtenues côte à côte, faces coupées vers le haut, et faites un tressage en faisant passer chaque moitié par-dessus l’autre. Étape 16 Couper la tresse au centre, vous obtenez deux babkas que vous pouvez déposer dans deux moules à cake (graissés et recouverts d’un rectangle de papier cuisson au fond). Étape 17 Recouvrez les deux moules d’un torchon humide et laissez gonfler une heure voire plus, dans un lieu de préférence chaud. Si vous êtes pressés, faire pousser au four à 30°C pendant 25 à 30 min. Étape 18 Pendant ce temps, on prépare le sirop : porter lentement l’eau et le sucre à ébullition puis laisser refroidir. Étape 19 Placer les babkas au four à 160°C chaleur tournante pendant une trentaine de minutes. Étape 20 Le babka est plus moelleux quand il n’est pas trop cuit. Le babka est cuit quand vous passez un couteau dedans et qu’il ressort sans pâte dessus. On doit obtenir une belle couleur brune et dorée. Étape 21 Badigeonner de sirop de sucre à la sortie du four, laisser refroidir et démouler. M Marmiton_Recettes",0,1
"Ingrédients Pour 10 pièces la pâte 23 cl de lait 10 g de levure boulangère fraîche 7 cl d'huile de tournesol 400 g de farine 5 g de sel 10 g de sucre la farce 100 g de feta 200 g de halloumi 5 g de persil 5 g de menthe sèche 1 g de poudre d'anis poivre blanc huile de friture Préparation Préparez la pâte. Versez le lait dans une casserole et faites-le tiédir légèrement. Retirez du feu, ajoutez la levure émiettée et laissez reposer 20 mn. Mélangez le lait et l’huile dans la cuve d’un robot pâtissier muni de la feuille, puis ajoutez la farine, le sel et le sucre. Pétrissez pendant 10 mn. Débarrassez et réservez 1 h à température ambiante. Préparez la farce. Coupez les fromages en petits dés. Émincez le persil et la menthe, puis ajoutez l’anis et un peu de poivre blanc. Mélangez le tout et passez la préparation au hachoir. Réservez au réfrigérateur. Étalez la pâte au rouleau à pâtisserie sur un plan de travail fariné pour obtenir une épaisseur de 3 à 4 mm. Détaillez des disques de 10 cm de diamètre. Déposez 1 grosse cuil. à soupe de farce au centre de chaque disque de pâte abaissée, puis refermez en deux et appuyez sur les bords à l’aide d’une fourchette. Faites chauffer un bain d’huile à 180 °C dans une sauteuse et faites frire les chaussons 5 mn, ou faites-les cuire au four 20 mn à 180 °C.",0,1
"La recette Pour 6 personnes et dans l’ordre idéal de préparation La semoule de brocoli et de chou fleur : Une belle tête de brocoli, un petit chou fleur, sel, poivre, 1/2 bouquet d’estragon, 1 filet d’huile de noisette, 1/2 citron au sel. Râpez à l’aide d’un économe les sommités de chou fleur et faites de même pour le brocoli en utilisant un petit couteau d’office. Réunissez les 2 semoules dans une passoire fine. Ébouillantez-les une minute en posant la passoire sur une casserole d’eau bouillante, un peu comme pour un bain-marie – cf photo- Égouttez, assaisonnez à convenance avec sel poivre et huile de noisette. Ajoutez l’estragon ciselé et le zeste de citron confit au sel finement haché, mélangez intimement, filmez, réservez. Le jus persillé : un beau bouquet de persil plat, 80g d’eau de cuisson, 50g d’huile d’olive, sel. Faites blanchir 3min à l’eau bouillante salée le persil effeuillé. Égouttez en réservant 80g d’eau de cuisson et plongez-le dans de l’eau avec des glaçons pour arrêter la cuisson et conserver la belle couleur verte. Mixez au blender avec l’eau de cuisson puis ajoutez dans le bol du blender l’huile d’olive et émulsionnez le tout. Réservez dans un flacon doseur en plastique pour faciliter le dressage. La duxelle de champignons : 300g de beaux champignons de Paris, 1 échalote, 40g de vin blanc sec, 1 noix de beurre ou un filet d’huile d’olive. Épluchez les champignons sans les laver bien sûr, détaillez-les en fine brunoise. Ciselez l’échalote. Dans une sauteuse faites suer à feu doux l’échalote au beurre ou à l’huile d’olive selon vos préférences. Ajoutez les champignons et le vin blanc, faites réduire à sec, rectifiez l’assaisonnement et réservez. Le risotto de crozets : 300g de crozets, 1 oignon, 550g de bouillon de volaille maison si possible, 80g de vin blanc, 1 feuille de laurier, 50g de mascarpone, sel, poivre, huile d’olive. Dans une casserole faites suer l’oignon finement ciselé à l’huile d’olive avec la feuille de laurier. Ajoutez les crozets et faites cuire 2 min en remuant sans cesse. Ajoutez le vin blanc et laissez réduire. Poursuivez la cuisson à feu doux en ajoutant petit à petit le bouillon de volaille sans cesser de remuer exactement comme pour un risotto classique. Quand la cuisson est al dente, retirez la feuille de laurier, ajoutez le mascarpone mélangez bien et rectifiez l’assaisonnement. Le poisson : 6 tronçons de St Pierre parés, 1 noix de beurre, un filet d’huile d’olive, sel poivre. Chauffez le four à 190°. Dans une poêle chaude, colorez les filets de St Pierre à l’huile d’olive côté peau. Quand la peau est bien colorée, ajoutez la noix de beurre, retournez-les 5 secondes, puis déposez les filets dans un plat, assaisonnez et passez 4 min au four pour terminer la cuisson. Le dressage : Au fond des assiettes chaudes posez les emporte pièces pour faciliter le dressage et avoir un joli look. Dressez au fond du moule rectangulaire une couche de duxelle de champignons préalablement réchauffée au micro ondes. Tassez bien et recouvrez avec le risotto de crozets. Dans le cercle dressez la semoule elle aussi réchauffée en égalisant la surface avec le dos d’une cuillère. Retirez le cercle et l’emporte pièce rectangulaire, faites un trait de jus persillé entre les deux. Posez enfin le filet de poisson sur la semoule et servez sans attendre Le rétro planning sécurisant : J-1 : La semoule de chou fleur et de brocoli peut sans problème se préparer à l’avance, il suffira de la réchauffer en temps utile, une bonne chose de faite. J-1 : On se débarrasse aussi de la mise en place du poisson. Certes la recette préconise du St Pierre mais vous pouvez à votre guise utiliser du dos de cabillaud, voire même un bon saumon. Si votre poissonnier ne l’a pas fait, parez les filets et ôtez les arêtes à la pince à épiler, réservez-les filmés sur un plateau au réfrigérateur. J-1 : On peut aussi préparer tranquillement le jus persillé on le réserve ensuite dans un flacon verseur en plastique que l’on pourra facilement réchauffer au bain marie, cool non ? J-1 ou J-0 : vous pouvez aussi mettre en place la duxelle de champignons selon votre humeur toujours avec l’idée de la réchauffer au moment du dressage. On gagne du temps on gagne du temps… J-0 : il ne reste plus que le risotto de crozets et la cuisson minute ou presque du poisson ce qui quand même facilite les choses pour peu que vous ayez déjà préparé votre dessert et choisi une entrée légère style une petite soupe ou un petit velouté de saison, le repas s’annonce sous de bons augures ….",0,1
"Let’s go en cuisine pour préparer ce gâteau sucré à la pomme de terre! Imprimer Épingler la recette 5 de 4 votes Gâteau sucré à la pomme de terre Un gâteau tout moelleux et sans gluten grâce à la patate! Temps de préparation10 minutes min Temps de cuisson45 minutes min Type de plat: Dessert, GoûterCuisine: Française Mots-clés: pommes de terre, poudre d’amandes Matériel nécessaireMoule à gâteau (pas trop grand, ici le moule cosy (22,5*16*4 cm, 110 cl de contenance) Ingrédients 300 g de pommes de terre3 oeufs100 g de beurre mou125 g de poudre d'amandes100 g de sucre (seulement 75 g pour moi)1 sachet de levure chimique1 cs de rhum1 poignée de pépites de chocolat InstructionsFaire cuire les pommes de terre (avec leur peau) à l'eau dans une casserole pendant 20 min. (ou comme moi, les cuire pelées et coupées en lamelles épaisses dans un récipient adapté au micro-ondes avec un petit fond d'eau pendant 10 min).Préchauffer le four à 150° (chaleur tournante).Égoutter et peler les pommes de terre puis les écraser en purée (directement dans la cuve du robot muni de la feuille).Ajouter les jaunes d'oeufs, le beurre mou en morceaux, la poudre d'amandes, le sucre, la levure et le rhum. Bien mélanger. Monter les blancs en neige et les incorporer délicatement dans la pâte.Verser la moitié de la pâte dans le moule (beurré et fariné si nécessaire) puis répartir les pépites de chocolat.Recouvrir avec le reste de pâte. Lisser puis enfourner.Laisser cuire 45 min.Démouler tiède et laisser refroidir avant de déguster.",0,1
"Ingrédients 9 feuilles de lasagnes sans gluten 125 g de pois chiches 85 cl d'eau filtrée cumin en poudre 3 cuillère(s) à soupe d'huile d'olive muscade jus de citron 300 g de champignons de Paris 1 gros oignon rouge 3 gousses d'ail huile de coco 350 g de patates douces 85 g de kale pignons de pin ras el-hanout 5 cl d'eau Préparation Faites tremper les pois chiches 12 h dans le double d’eau. Le lendemain, égouttez et rincez-les. Mixez-les 1 mn à pleine vitesse avec l’eau filtrée. Passez le tout à travers une passoire, puis faites cuire 10 mn dans une casserole sur feu moyen-doux. Remuez sans cesse avec une cuillère en bois. Salez, poivrez, muscadez, ajoutez 1/2 c. à café de cumin, l’huile d’olive et le jus de citron. Préchauffez le four sur th. 6-7/200°. Lavez, coupez les champignons en lamelles. Pelez les patates douces, coupez-les en cubes. Coupez en dés l’oignon et l’ail pelés, faites-les revenir avec un peu d’huile de coco. Ajoutez les légumes, ⅓ c. à café de cumin, 1/2 c. à café de ras-el-hanout, et laissez cuire 8 mn. Versez un peu d’eau, continuez la cuisson jusqu’à ce que les patates soient tendres. Ajoutez 2 c. à soupe de pignons de pin. Montez les lasagnes en commençant par une couche de béchamel de pois chiches, 3 lasagnes, la garniture, etc., en finissant par la béchamel. Poivrez un peu et enfournez 45 mn.",0,1
"Ingrédients 1 cuillère à soupe de sucre glace 1 banane 0.5 cuillère à café de vanille 60 g de sucre semoule 3 yaourts au lait entier 200 g de mascarpone 1 kiwi 1 pomme granny 1 citron (pour son jus) Voir plus Voir moins En cliquant sur les liens, vous pouvez être redirigé vers d’autres pages de notre site, ou sur Amazon.fr La suite après cette publicité Ustensiles 1 Fouet cuisine Top 5 des meilleurs fouets Acheter 1 saladier Les meilleures ventes Acheter 1 balance de cuisine Top des meilleures balances + de détails 1 Frigo Top des meilleurs réfrigérateurs + de détails En cliquant sur les liens, vous pouvez être redirigé vers d’autres pages de notre site, ou sur Amazon.fr Préparation Temps total : 15 min Préparation : 15 min Repos : - Cuisson : - Étape 1 Mélangez les yaourts avec le Mascarpone, le sucre, l'essence de vanille dans un saladier. Travaillez au fouet électrique de façon à avoir une préparation onctueuse. Répartissez cette crème dans de beaux verres évasés ou dans des coupes. Mettez-les au réfrigérateur. Étape 2 Pelez le kiwi, coupez-le en petits morceaux. Pelez la pomme et taillez-la en petits dés. Epluchez la banane et découpez-la en fines rondelles. Étape 3 Mélangez les fruits dans une jatte, arrosez-les de jus de citron, saupoudrez de sucre glace et remuez délicatement. Mettez-les au frais. Étape 4 Juste au moment de servir, répartissez la salade de fruits dans les coupes. e eva_14045652",0,1
"Ingrédients 300 g de quinoa rouge 1 poivron rouge 1 poivron vert 1 oignon 1 concombre 3 carottes 1 botte de persil 1 botte de coriandre 1 grosse boîte de thon au naturel 200 g de pois chiches cuits 50 g de poudre d'amandes huile d'olive bio 1 citron vert bio 1 citron jaune bio piment de cayenne sel, poivre Préparation Rincez le quinoa, mettez-le dans une casserole et recouvrez-le largement d’eau froide. Portez à ébullition et laissez cuire 10 mn environ : les graines doivent s’entrouvrir et rester tendres. Égouttez et laissez refroidir. Rincez les poivrons et coupez la pulpe en dés. Épluchez l’oignon et hachez-le. Pelez le concombre, retirez les graines, coupez-le en dés puis salez-le dans une assiette pour qu’il « transpire » un peu. Pelez les carottes et râpez-les finement. Rincez les herbes, essorez-les et effeuillez-les. Égouttez le thon et émiettez-le. Rincez les pois chiches et égouttez-les. Mélangez le quinoa avec tous les ingrédients. Saupoudrez de poudre d’amandes, arrosez d’huile d’olive, pressez les citrons au-dessus de la salade puis mélangez encore en ajoutant du sel, du poivre et du piment. Servez aussitôt. Réalisation Élisabeth Scotto. Stylisme Sergio Da Silva. Recettes recueillies par Marina Rozenman.",0,1
"Ingrédients : Pour 4 personnes 500 g de panais ½ l de lait 10 cl de crème liquide 1 peu de gros sel 1 càs d’huile de noisette 2 boudins noirs . Sauce 20 cl de fond de veau 10 cl de crème liquide Champignons trompettes Préparation du Parmentier de boudin noir et panais Préparation : 15 mn Cuisson : 50 mn . Préparer la sauce : • Faites réduire de moitié le fond blanc. • Ajoutez la crème et laissez réduire jusqu’à napper la cuillère en bois puis, passez au chinois. • Maintenez au chaud dans un bain marie. • Taillez les trompettes en petits morceaux et trois bâtonnet par personne pour la décoration. • Les petits morceaux seront rajoutés à la sauce au moment de servir. . Préparer le Parmentier : • Épluchez et taillez les panais en cubes. • Faites-les cuire doucement dans le lait avec du gros sel. • Passes le panais au presse-purée. • Faites fondre le beurre et ajoutez-le à la purée de panais, • Ajoutez la crème à la pulpe de panais et mélangez-la bien. • Gardez au chaud au bain-marie, • Posez un film plastique sur le dessus pour éviter la formation d’une croûte. • Incisez et enlevez la peau du boudin. • À feu doux émiettez et faites revenir le boudin dans l’huile de noisette. . Dressage : • Beurrez le pourtour de cercles pour faciliter le démoulage. • Disposez la farce de boudin dans les cercles, tassez avec une cuillère. • Ajoutez la purée de panais, tassez et lissez avec une spatule. • Ajoutez la sauce autour du Parmentier et décorez avec les bâtonnets de trompettes.",0,1
