regime,valeur réelle,valeur prédite
"Let’s go en cuisine pour préparer ces burgers à la raclette et à l’oignon confit! Imprimer Épingler la recette 5 de 2 votes Burgers à la raclette et à l’oignon confit Temps de préparation20 minutes min Temps de cuisson15 minutes min Type de plat: Plat principal Mots-clés: boeuf, burgers, moutarde, oignons, raclette Portions: 4 Ingrédients 2 beaux oignons rouges2 cc de sucre4 steaks hachés4 pains à burgers120-150 g de fromage à raclettede la moutardede l'huile d'olivesel, poivre InstructionsPeler et émincer finement les oignons.Les faire revenir dans un filet d'huile d'olive dans une poêle pendant quelques minutes.Ajouter le sucre et laisser confire en mélangeant régulièrement pendant une bonne dizaine de minutes. Saler et poivrer.Pendant ce temps, chauffer un peu d'huile dans une autre poêle pour y cuire les steaks (le temps dépendra de la cuisson désirée). Saler et poivrer.En fin de cuisson, poser le fromage à raclette en tranches sur les steaks et couvrir la poêle pour faire fondre le fromage.Couper les pains à burgers en deux et les passer quelques instants au four (ou au grille-pain) pour les toaster.Tartiner les pains de moutarde, déposer du confit d'oignons et le steak à la raclette.Refermer les burgers et dégustez!",1,1
"Ingrédients 16 litchis + quelques-uns pour décorer 2 feuilles de gélatine 250 g de yaourt grec 2 cuillère(s) à café d'extrait de rose 25 cl de crème fleurette entière bien froide 30 g de sucre glace 175 g de boudoirs quelques pétales de rose non traités Préparation Faites tremper la gélatine dans un bol d’eau froide. Pelez, dénoyautez et hachez finement les litchis. Prélevez 2 c. à soupe de yaourt grec et délayez-le dans une casserole avec 4 c. à soupe d’eau et l’extrait de rose. Portez à ébullition, arrêtez la cuisson, essorez la gélatine ramollie et plongez-la dans la casserole. Réservez. Montez la crème fleurette en chantilly en ajoutant peu à peu le sucre glace. Fouettez le contenu de la casserole, mélangez-le avec le reste de yaourt grec et les litchis hachés, puis ajoutez la chantilly et mélangez délicatement. Tapissez les parois d’un moule à charlotte de film alimentaire. Rangez des boudoirs en hauteur à l’intérieur du moule, puis au fond. Versez la moitié de la préparation au yaourt. Rangez des boudoirs sur la crème au yaourt pour la recouvrir et versez le reste dessus. Couvrez de film alimentaire et placez au frais pour 6h minimum. Démoulez la charlotte, ôtez le film alimentaire et servez bien frais, décorée de litchis et de pétales de roses.",1,1
"Ingrédients 200 g de sucre 125 g de farine de châtaigne 1 l de lait entier 4 oeufs Voir plus Voir moins En cliquant sur les liens, vous pouvez être redirigé vers d’autres pages de notre site, ou sur Amazon.fr La suite après cette publicité Ustensiles 1 saladier Les meilleures ventes Acheter 1 casserole Top 3 des batteries de casseroles + de détails 1 Four Top des meilleurs fours + de détails 1 balance de cuisine Top des meilleures balances + de détails En cliquant sur les liens, vous pouvez être redirigé vers d’autres pages de notre site, ou sur Amazon.fr Préparation Temps total : 18 min Préparation : 15 min Repos : - Cuisson : 3 min Étape 1 Chauffer 2/3 du lait et ajouter le reste de lait froid. Étape 2 Ajouter la farine au lait en mélangeant bien puis mettre 10 min sur le feu en remuant. Étape 3 Ôter la casserole du feu et incorporer les oeufs et le sucre. Étape 4 Mettre le tout dans un moule et cuire à four chaud 30 min. c camila_14650432",1,1
"Ingrédients 8 carottes anciennes (rouges, violettes...) 2 pamplemousses 50 g de dattes 1 bouquet de coriandre sel et poivre la vinaigrette 30 cl d'huile d'olive le jus de 1 citron jaune le jus de 1 citron vert 2 cuillère(s) à soupe de vinaigre balsamique blanc 1 cuillère(s) à soupe de sirop d'érable Préparation Épluchez les carottes, taillez-les en fines rondelles à l’aide d’une mandoline et réservez-les dans un saladier. Pelez les pamplemousses à vif et prélevez les suprêmes : glissez la lame d’un couteau entre la membrane blanche et la pulpe pour détacher les quartiers. Réalisez cette opération au-dessus d’une assiette pour récupérer le jus. Préparez la vinaigrette. Émulsionnez tous les ingrédients et le jus des pamplemousses jusqu’à obtenir une sauce homogène. Versez-la sur les carottes et mélangez bien avec les mains. Laissez mariner 1 h au frais. Dénoyautez et hachez grossièrement les dattes. Rincez et ciselez la coriandre. Mélangez le tout à la salade de carottes et incorporez les suprêmes de pamplemousse. Salez, poivrez et mélangez encore. Servez aussitôt.",1,1
"Ingrédients sel huile d'olive 200 g d' olives vertes farcies aux anchois toutes prêtes (celles en bocal sont meilleures que celles en boîte) 2 gousses d' ail Voir plus Voir moins En cliquant sur les liens, vous pouvez être redirigé vers d’autres pages de notre site, ou sur Amazon.fr La suite après cette publicité Préparation Temps total : 5 min Préparation : 5 min Repos : - Cuisson : - Étape 1 Broyer les olives déja farcies avec les deux gousses d'ail. Attention à ce que ça ne devienne pas de la bouillie! Étape 2 Ajouter un filet d'huile d'olive. Étape 3 Un peu de sel (selon votre goût car les anchois apportent déjà du sel). Étape 4 C'est prêt! l laura_16669326",1,1
"Ingrédients 1 avocat bien mûr 200 g de fraises 1 cuillère(s) à soupe d'huile d'olive poivre au moulin 4 brins de menthe 1 cuillère(s) à soupe de miel Préparation Pelez l’avocat, ôtez le noyau et coupez-le en petits dés. Équeutez les fraises et coupez-les en petits morceaux. Mélangez 1/3 d’avocat pour 2/3 de fraises, ajoutez l’huile d’olive et 2 tours de moulin à poivre. Si les fraises sont très mûres, servez-les ainsi avec un peu de menthe émincée. Si les fraises sont acidulées, comme souvent en début de saison, faites fondre 1 c. à soupe de miel dans 10 cl d’eau bouillante et ajoutez ce sirop à la salade servie dans des bols.",1,1
"Ingrédients 1 filet d' huile olive 100 g de farine 100 g de margarine 1 cuillère à soupe de sucre 14 tomates (ou 500 g de pulpe) 1 oignon 6 aubergines 100 g de protéine de soja 0.5 l de lait de riz Voir plus Voir moins En cliquant sur les liens, vous pouvez être redirigé vers d’autres pages de notre site, ou sur Amazon.fr La suite après cette publicité Ustensiles 1 économe Top 5 des meilleurs économe + de détails 1 Couteau Top des meilleurs couteaux de cuisine + de détails 1 Four top des meilleurs fours + de détails 1 Mixeur Les meilleures ventes Acheter 1 Set 3 poêles Notre sélection des meilleures poêles + de détails 1 Râpe Top des meilleures râpes + de détails 1 Couvercle Les meilleures ventes Acheter 1 Cuillère en bois Les meilleures ventes Acheter 1 casserole Top 3 des batteries de casseroles + de détails 1 Spatule Top des meilleures spatules + de détails 1 saladier Les meilleures ventes Acheter 1 Fouet cuisine Top 5 des meilleurs fouets Acheter 1 dénoyauteur Les meilleures ventes Acheter 1 balance de cuisine Top des meilleures balances + de détails 1 plat + de détails Voir plus Voir moins En cliquant sur les liens, vous pouvez être redirigé vers d’autres pages de notre site, ou sur Amazon.fr Préparation Temps total : 2 h Préparation : 1 h Repos : - Cuisson : 1 h Étape 1 Préparation des aubergines Étape 2 Laver et éplucher les aubergines. Étape 3 Couper les aubergines en tranches, dans le sens de la longueur. Étape 4 Déposer sur une plaque huilée les tranches, saler et les enfourner 30 min à 180°C (thermostat 6). Étape 5 Préparation de la sauce tomate Étape 6 Éplucher et hacher finement l'oignon. Étape 7 Le faire revenir dans un peu d'huile d'olive et le sucre. Étape 8 Laver les tomates et les râper afin d'obtenir la pulpe sans trop de peau. Étape 9 Ajouter la pulpe de tomate à l'oignon. Étape 10 Laisser cuire 15 min à feu doux. Étape 11 Saler, ajouter les protéines de soja, mélanger le tout et couvrir. Réserver . Étape 12 Préparation de la béchamel Étape 13 Dans une casserole à feu doux, faire fondre la margarine. Étape 14 Ajouter d'un seul coup toute la farine et à l'aide d'une spatule mélanger. Le mélange doit se décoller du fond de la casserole mais ne pas accrocher. Étape 15 Incorporer petit à petit le lait. Utiliser un fouet pour éviter les grumeaux et laisser épaissir. Étape 16 Pour ce plat, la béchamel n'a pas besoin d'être très épaisse au contraire. Saler et réserver. Étape 17 Assemblage et cuisson Étape 18 Dans un plat huilé à bord haut, disposer premièrement des tranches d'aubergines, puis la sauce tomate et enfin la béchamel. Étape 19 Procéder ainsi jusqu'à épuisement de tous les ingrédients, en terminant par la béchamel. Étape 20 Enfourner à 200°C (thermostat 6-7) pendant environ 1h. Étape 21 La moussaka est souvent meilleure réchauffée le lendemain, la deuxième cuisson permettant d'assécher le plat et de concentrer les saveurs. r romina_521412",1,1
"Ingrédients 2 cuillères à soupe de coriandre ciselée 1 cuillère à café de cumin 1 poivron rouge coupé en dés 175 g de carotte coupées en dés 1 oignon 20 cl d' huile 1 gousse d' ail écrasée 225 g de pomme de terre coupées en dés 100 g de petits pois 2 cuillères à soupe de pâte de curry 3 cuillères à soupe de chutney de mangue 16 feuilles de filo Voir plus Voir moins En cliquant sur les liens, vous pouvez être redirigé vers d’autres pages de notre site, ou sur Amazon.fr La suite après cette publicité Ustensiles 1 Set 3 poêles Notre sélection des meilleures poêles + de détails 1 Cuillère en bois Les meilleures ventes Acheter 1 Couvercle Les meilleures ventes Acheter 1 Fouet cuisine Top 5 des meilleurs fouets Acheter 1 pinceau 6,72€ + de détails 1 couteau Top 3 des couteaux + de détails Voir plus Voir moins En cliquant sur les liens, vous pouvez être redirigé vers d’autres pages de notre site, ou sur Amazon.fr Préparation Temps total : 1 h Préparation : 25 min Repos : - Cuisson : 35 min Étape 1 Dans une poêle, chauffer 2 cuillers à soupe d'huile. Étape 2 Faire revenir l'oignon et l'ail 1 min. Ajouter les carottes, les pommes de terre et le poivron. Remuer 5 min. Étape 3 Ajouter le cumin et la pâte de curry. Remuer 2 min. Étape 4 Délayer avec 4 cuiller à soupe d'eau, couvrir et laisser mijoter 5 min à feu doux. Étape 5 Incorporer les petits pois, le chutney et la coriandre. Oter du feu. Étape 6 Couper les feuilles de filo en deux dans la longueur. Les huiler au pinceau. Étape 7 Déposer un peu de farce dans un coin et refermer en triangle. Étape 8 Faire dorer les samosas 5 par 5 dans le reste d'huile bouillante, 2 min de chaque côté et bien les égoutter. a agathe_16139610",1,1
"Ingrédients 100 g de sucre en poudre 30 cl de crème fleurette 4 meringues 4 oeufs 1 sachet de sucre vanillé 0.5 arôme vanille (ou 10 ml) 1 caramel (210 g) Voir plus Voir moins En cliquant sur les liens, vous pouvez être redirigé vers d’autres pages de notre site, ou sur Amazon.fr La suite après cette publicité Ustensiles 1 sorbetière + de détails 1 saladier Les meilleures ventes Acheter 1 Fouet cuisine Top 5 des meilleurs fouets Acheter 1 congélateur + de détails 1 Cuillère en bois Les meilleures ventes Acheter 1 Moule à cake Top des moules à cake 2022 + de détails 1 Four Top des meilleurs fours + de détails 1 fourchette + de détails 1 balance de cuisine Top des meilleures balances + de détails Voir plus Voir moins En cliquant sur les liens, vous pouvez être redirigé vers d’autres pages de notre site, ou sur Amazon.fr Préparation Temps total : 20 min Préparation : 20 min Repos : - Cuisson : - Étape 1 POUR LA GLACE VANILLE: Étape 2 Dans un saladier battre les jaunes et le sucre. Étape 3 Dans un 2ème saladier fouetter la crème et le sucre vanillé en chantilly (auparavant, mettre la crème dans le saladier avec les batteurs 30 mn au congélateur). Lorsque la crème est bien battue (battre au moins 5 mn) ajouter la vanille en continuant de battre. Étape 4 Dans un 3ème saladier battre les blancs en neige. Étape 5 Incorporer délicatement (en soulevant la préparation avec une cuiller) les blancs aux jaunes, puis la chantilly. N'essayez pas de trop mélanger, cela ferait retomber la mousse. Étape 6 MONTAGE DU VACHERIN: Étape 7 Dans chaque moule à cake, mettre la moitié du caramel, puis 2 meringues cassées en morceaux (la meringue doit monter jusqu'à la moitié de la hauteur de chaque moule à cake). Étape 8 Ajouter enfin la moitié de la préparation dans chaque moule. Étape 9 Laisser prendre au congélateur pendant une nuit au moins et démouler au moment de servir. Étape 10 A aucun moment il ne faut casser la glace à la fourchette, une fois que le vacherin est au congélateur, il ne faut plus y toucher. e emmy_17643254",1,1
"Ingrédients 2 filets de bar 2 courgettes jaunes 1 citron confit au sel Pour le leche de tigre 2 concombres 2 bâtons de rhubarbe épluchés 1 pomme granny-smith 2 branches de céleri le vert de 1 botte de cébettes 1 botte de basilic + quelques feuilles Pour servir huile de colza bio le jus et les zestes de 4 citrons verts bio Préparation Préparez le leche de tigre (marinade) : rincez soigneusement les concombres, la pomme, le céleri, le vert des cébettes et le basilic. Passez à la centrifugeuse ou à l’extracteur de jus tous les ingrédients du leche de tigre, à l’exception du basilic. Une fois le jus obtenu, versez un filet d’huile de colza, et faites infuser la botte de basilic lavée et séchée dans le leche à froid et au frais. Les feuilles vont ainsi parfumer le jus sans noircir. Filtrez après 1 h. Rectifiez l’assaisonnement en sel et poivre. Prélevez la peau des courgettes et du citron confit à l’économe ou à la mandoline. Puis détaillez l’ensemble en mini-brunoise pour obtenir des micro-cubes jaunes. Détaillez les filets de bar en tranches de 3 à 4 mm. Dressez les tranches de bar dans les assiettes creuses, ajoutez la mosaïque de citron confit et courgette jaune crue, versez le leche de tigre, agrémentez de petites feuilles de basilic frais et dégustez aussitôt.",1,1
"Ingrédients sel huile d'olive 2 tomates 1 verre de quinoa 0.5 concombre 20 feuilles de menthe 1 échalote jus de citron Voir plus Voir moins En cliquant sur les liens, vous pouvez être redirigé vers d’autres pages de notre site, ou sur Amazon.fr La suite après cette publicité Ustensiles 1 Top 5 des meilleures passoires 16,90€ + de détails 1 saladier Les meilleures ventes Acheter 1 dénoyauteur Les meilleures ventes Acheter En cliquant sur les liens, vous pouvez être redirigé vers d’autres pages de notre site, ou sur Amazon.fr Préparation Temps total : 30 min Préparation : 15 min Repos : - Cuisson : 15 min Étape 1 Faire cuire le quinoa 15 minutes dans l'eau bouillante. Une fois cuit, refroidissez-le en le rincant a l'eau froide et laissez-le s'égoutter dans une passoire. Étape 2 Pendant que le quinoa cuit, rincez les tomates, retirez les pépins et le jus qui s'en écoule et coupez les tomates en tous petits cubes. Étape 3 Epluchez le demi-concombre, enlevez les graines et coupez-le, lui aussi, en tous petits dés. Coupez très finement la menthe et l'échalote. Étape 4 Mélangez tous les légumes avec le quinoa froid. Assaisonnez avec du jus de citron, du sel et de l'huile d'olive ! e emma_16213222",1,1
"Ingrédients 4 cuillères à soupe d' huile d'olive 400 g de boeuf (coupé très fin par le boucher) 1 bouquet de ciboulette 1 citron 30 g de parmesan râpé 1 poignée de baies roses 1 poignée de graines de coriandre 1 oignon nouveau (cébette...) Voir plus Voir moins En cliquant sur les liens, vous pouvez être redirigé vers d’autres pages de notre site, ou sur Amazon.fr La suite après cette publicité Préparation Temps total : 20 min Préparation : 20 min Repos : - Cuisson : - Étape 1 Étaler les tranches de boeuf sur un plat (sans qu'elles se chevauchent). Étape 2 Verser le jus du citron et l'huile d'olive, sur la viande. Étape 3 Ajouter les baies roses, les graines de coriandre et l'oignon haché finement. Étape 4 Et saupoudrer de parmesan. Étape 5 Laisser mariner au moins 2 heures. Étape 6 Au moment de servir, ajouter la ciboulette finement ciselée. c crifi Note de l'auteur : « Ce plat peut également être servi en plat principal (en augmentant un peu les quantités) accompagné d'une salade de roquette au vinaigre balsamique et de frites maison. » La suite après cette publicité Découvrez les meilleurs accords mets et vins autour des viandes rouges avec Voir la sélection En partenariat avec Tanin.fr Qu'est-ce qu'on mange ce soir ? De l'inspiration chaque jour avec des recettes faciles, gourmandes et de SAISON :)",1,1
"Let’s go en cuisine pour préparer ce domoda aux boulettes! Imprimer Épingler la recette 5 de 1 vote Domoda aux boulettes (ragoût de viande sénégalais) Temps de préparation25 minutes min Temps de cuisson35 minutes min Type de plat: Plat principalCuisine: Africaine Mots-clés: boeuf, boeuf haché, carottes, citron, patates douces, piment oiseau, sauce tomate Portions: 4 Matériel nécessaireCocottePoêle Ingrédients 1 patate douce2 carottes1 oignon1 piment oiseau2 gousses d'ail1 filet d'huile d'olive500 g de purée de tomate1 bouquet garni500 g de viande de boeuf hachée3 cs de farine120 ml d'eau (pour la sauce)1 citronsel, poivre InstructionsCommencer par préparer légumes:Peler et couper en morceaux la patate douce et les carottes.Peler et émincer l'oignon, peler et écraser les gousses d'ail et hacher finement le piment (quantité à adapter selon les goûts).Préparer la sauce:Dans une cocotte, faire revenir l'oignon dans l'huile chaude pendant quelques minutes. Ajouter l'ail écrasé, la purée de tomate, le bouquet garni, le piment ainsi que les légumes en morceaux.Ajouter environ 90 cl d'eau, saler et poivrer.Laisser mijoter à couvert environ 25-30 min jusqu'à ce que les légumes soient bien cuits (si besoin ajouter un peu d'eau pour terminer la cuisson des légumes).Pendant ce temps, préparer les boulettes:Dans un petit saladier, saler et poivrer la viande hachée et mélanger.Façonner une bonne douzaine de boulettes.Faire chauffer un peu d'huile dans une poêle et y faire dorer les boulettes sur toutes les faces.Couvrir la poêle et baisser le feu puis poursuivre la cuisson environ 5 min.Finaliser la sauce:Dans un petit bol, diluer la farine dans l'eau puis ajouter le jus du citron pressé.A l'aide d'une écumoire, retirer les légumes de la sauce et les réserver dans un bol.Ajouter la farine diluée dans la cocotte et bien mélanger. Poursuivre la cuisson en mélangeant vivement jusqu'à ce que la sauce soit bien homogène. Rectifier l'assaisonnement.Ajouter les légumes réservés ainsi que les boulettes dans la sauce et laisser cuire encore quelques minutes.Servir le domoda bien chaud avec du riz.Notes:Attention au piment, si vous n'avez pas l'habitude, mettez-en seulement un petit peu au début et goûtez (et surtout pensez à bien vous lavez les mains après l'avoir manipulé!).",1,1
"La recette Pour un cercle à entremets de 16cm x 4.5cm soit pour 6 à 8 personnes selon la gourmandise Prévoir environ 400g de fruits rouges pour la finition. Biscuit à la cuillère : 50g de farine T55, 50g de fécule de pomme de terre ou à défaut de maïzena, 5 œufs, 100g de sucre semoule, un peu de colorant rose -facultatif- QS de sucre glace. Tamiser la farine et la fécule. Monter les blancs à vitesse moyenne en ajoutant le sucre en 3 fois dès qu’ils commencent à mousser. Quand les blancs sont au bec d’oiseau diminuer la vitesse ajouter les jaunes et continuer à battre 15 secondes, le temps qu’ils soient bien incorporés. Ajouter éventuellement un peu de colorant rose. Verser en pluie les poudres et incorporez-les délicatement à la maryse. Pocher sur une feuille de papier cuisson les bandes extérieures puis 2 disques de 15 cm de diamètre. Avant d’enfourner, poudrer 2 fois de sucre glace à 5min d’intervalle les bandes pour l’extérieur de l’entremets pour avoir un look perlé. Enfourner 10 min à 200° à surveiller. Démouler avec précaution. Laisser refroidir. Mousse bavaroise vanille : 1/4l lait entier, 3 jaunes d’œufs, 50g de sucre semoule, une gousse de vanille, 2 feuilles ½ de gélatine soit 5g, 200g de crème fleurette entière. Ramollir la gélatine à l’eau froide. Réaliser une crème anglaise, fendre la gousse de vanille et gratter les graines sur les jaunes d’œufs. Blanchir légèrement les jaunes avec le sucre, mélanger bien avec le lait, verser le tout dans une casserole et cuire à la nappe entre 82° et 84° si vous avez un thermo-sonde -clic-. Ajouter la gélatine essorée, filmer au contact et laisser refroidir à 25/30°. Quand la bonne température est atteinte fouetter légèrement l’appareil puis incorporez délicatement à la maryse la crème montée mousseuse. Réservez au réfrigérateur le temps qu’elle prenne un peu de consistance. Sirop ou coulis d’imbibage 50g d’eau, 50g de sirop de framboise –facultatif- ou Coulis : 500g framboises, le jus d’1/2 citron, 200g de sucre semoule. Mixer les framboises, le jus de citron et le sucre, passer au tamis, réserver au frais. Montage et finition : chemiser si possible de rhodoïd le cercle à entremets posé sur une semelle en carton, ajouter tout autour la bande de biscuit à la cuillère. Poser un disque de biscuit au fond du cercle. Puncher le dessus au choix avec le sirop ou le coulis. Ajouter à la poche ou à la cuillère une couche de mousse bavaroise puis quelques fruits, recouvrir du second disque de biscuit punché des 2 côtés et renouveler l’opération. Réserver au minimum 2/3 heures au réfrigérateur puis décorez au moment de déguster. Servir éventuellement avec le coulis restant. Trucs et astuces Pour faciliter le dressage des bandes de biscuit à la cuillère aidez vous d’un gabarit maison. Dessiner sur une feuille de papier cuisson des bandes de 4.5cm de largeur et pocher en suivant les lignes. Idem pour les disques. Penser à retourner le papier cuisson pour que les traits n’apparaissent pas sur le biscuit. Vous pouvez congeler la charlotte sans la décoration finale. Il vous faudra la sortir du congélateur et la laisser reprendre consistance au réfrigérateur une nuit ou 6 heures. On peut aussi avant d’ajouter les fruits rouges poudrer les bords de la charlotte avec du codineige.",1,1
"Ingrédients 1 cuillère à soupe d' huile d'olive 200 g de saumon / personne 1 citron vert 2 cuillères à soupe de soja ciboulette fraîche Voir plus Voir moins En cliquant sur les liens, vous pouvez être redirigé vers d’autres pages de notre site, ou sur Amazon.fr La suite après cette publicité Ustensiles 1 couteau Top 3 des couteaux + de détails 1 bol Top des saladiers + de détails 1 paire de ciseaux Les meilleurs ciseaux de cuisine + de détails 1 dénoyauteur Les meilleures ventes Acheter 1 Réfrigérateur Notre top des mini réfrigérateurs + de détails Voir plus Voir moins En cliquant sur les liens, vous pouvez être redirigé vers d’autres pages de notre site, ou sur Amazon.fr Préparation Temps total : 15 min Préparation : 15 min Repos : - Cuisson : - Étape 1 Emincer très finement le saumon (pavé sans peau et sans arêtes), puis mettre au réfrigérateur. Étape 2 Préparer dans un bol : le jus du citron vert, la sauce au soja , et l'huile d'olive. Étape 3 Dans un autre bol, ciseler la ciboulette fraîche. Juste au moment de servir, mettre la sauce sur le saumon ainsi que la ciboulette. Étape 4 Servir avec des pousses de soja et un riz sauvage. e emmy_17594495",1,1
"Ingrédients 1 boîte 4/4 de carottes au naturel 1 petite boîte d'asperges vertes 15 cl de crème liquide 1 cube de bouillon de volaille ou légumes 50 cl d'eau sel et poivre Préparation Délayer le cube de bouillon dans l’eau bouillante et laisser tiédir. Verser dans le mixer le contenu de la boîte de carottes et les queues des asperges, mixer et ajouter le bouillon, la crème, le sel et le poivre. Tenir au fraiset verser dans des bols au moment de servir. Décorer avec les têtes d’asperges. Saupoudrer de cumin en poudre. Crédit photo : Studio b – Marc Hallet / UPPIA",1,1
