regime,valeur réelle,valeur prédite
"Ingrédients : Pour 4 personnes 4 filets d’agneau 3 càs de 4 épices 1 pincée de cannelle 1 càs d’huile d’olives 1 pots de navet au curry LéguM’andises 70g boulgour petit épeautre 1 càc d’huile d’olive 1/2 cube de bouillon Miso Préparation 1.Faire revenir la boulgourde petite épeautre dans une casserole avec une c à c d’huile d’olive d’eau. Délayer le 1/2 cube de bouillon Miso dans 200cl d’eau chaude et ajouter le au Boulgor. Saler et laisser cuire jusqu’à absorbtion totale du liquide. Maintenir au chaud. 2.Fariner les noisettes d’agneau avec le mélange 4 épices. 3.Faire revenir les filets d’agneau dans un peu beurre 3 à 4 min de chaque côté. Elles doivent rester rosées. 4.Déglacer la poêle avec un peu d’eau pour bien récupérer les sucs de la cuisson. 5.Faire réchauffer le navet au curry de Légum’andises dans une poêle ou une casserole. Assaisonner si besoin. Disposer deux noisettes d’agneau sur une assiette, nappées chacune d’un peu de sauce accompagnées du navet au curry et d’une petite rivière de boulgour de petite épeautre. Un peu d’histoire sur mon nouveau partenaire LEGUM’andise a pour projet l’économie solidaire. Ce projet unique en France d’économie solidaire locale et de développement durable a été initié par Antoine Campredon, ingénieur agro-alimentaire, en Champagne Ardennes et devrait par la suite se développer dans d’autres régions de France. Ancien Directeur de Bonduelle, Antoine Campredon est depuis longtemps sensibilisé par la faim dans le monde et le constat de ceux qui ont trop ou gaspillent et ceux qui n’ont absolument rien. Il y a bien l’aide alimentaire mais dès la fin 2013, l’Europe cessera d’apporter 60 millions pour l’aide alimentaire ». Il faut savoir que la France contribue à son niveau pour quatre millions et demi d’euros, la déduction est simple. Il décide de fonder le cabinet Tek-agrofood pour faire une étude sur la faisabilité d’une conserverie solidaire qui sera mandatée par la DRAAF-CA (Direction Régionale de l’Alimentation, de l’Agriculture et des Forêts de Champagne Ardenne) La création de la marque LEGUM’andise est partie d’un constat important : Le gaspillage important des denrées alimentaires comestibles dans le secteur de l’agro-alimentaire. En effet, ces produits hors calibres parce que trop petits, trop gros, pas assez ronds ou longs ne sont pas transformés par les industries alimentaires et sont tout à fait consommables ! Il faut savoir que la proportion de ces aliments mis au rebut représente 50 % des aliments achetés par les agroalimentaires et non vendus. – Une hausse de la pauvreté en France, et la remise en question du Programme européen d’aide au plus démunis (PEAD) sans cesse remis en question pénalisent encore une fois les plus pauvres. – Une raréfaction des denrées alimentaires accessibles aux plus démunis. la suite ici",1,1
"Ingrédients 3 bananes bien mures 3 bonnes cuillères à soupe de miel 100 g de sucre roux 150 g de beurre 300 g de flocons d'avoine 1 pincée de cannelle (facultatif) Voir plus Voir moins En cliquant sur les liens, vous pouvez être redirigé vers d’autres pages de notre site, ou sur Amazon.fr La suite après cette publicité Ustensiles 1 casserole Top 3 des batteries de casseroles + de détails 1 saladier Les meilleures ventes Acheter 1 Cuillère en bois Les meilleures ventes Acheter 1 Four top des meilleurs fours + de détails 1 Moule à tarte Les meilleures ventes Acheter 1 Rouleau à pâtisserie Top des meilleurs rouleaux à pâtisserie + de détails 1 couteau Top 3 des couteaux + de détails 1 balance de cuisine Top des meilleures balances + de détails Voir plus Voir moins En cliquant sur les liens, vous pouvez être redirigé vers d’autres pages de notre site, ou sur Amazon.fr Préparation Temps total : 40 min Préparation : 10 min Repos : - Cuisson : 30 min Étape 1 Faire fondre le beurre, avec le miel et le sucre. Étape 2 Pendant ce temps, écraser les bananes en purée; puis la mélanger avec les flocons d'avoine et le mélange beurre/sucre/miel. Étape 3 Etaler la pâte dans un moule à tarte ou une plaque de 25 cm, et faire cuire au four à 180°C (thermostat 6). Étape 4 Couper des tranches à la sortie du four, et déguster froid. l lina_16188063",1,1
"Ingrédients : Pour4 personnes 500 g de champignons de Paris 1 gros oignon 1 c à c bombée de pâte de gingembre 1 boîte de tomates de 300 g quelques brins de thym Coriandre fraiche Huile d’olive Sel, poivre Préparation du rougaille aux champignons Préparation : 15 mn Cuisson : 20 mn . • Nettoyez les champignons. • Émincez les très finement à l’aide d’une mandoline, attention aux doigts. • Epluchez l’oignon et l’ail, émincez l’ oignon puis hachez l’ail. • Faites chauffer un peu d’huile d’olive dans une sauteuse. • Faites revenir l’oignon, l’ail , le gingembre, et le thym. • Poursuivez la cuisson pendant 5 minutes • Ajoutez les tomates, salez, bien mélanger. • Au bout de 3 à 4 minutes, ajoutez enfin les champignons. • Laissez mijoter pendant environ 10 minutes. • Avant de servir, ajoutez la coriandre ciselée. • Servez avec un riz parfumé et des saucisses épicées si vous le souhaiter. . .",1,1
"Let’s go en cuisine pour préparer cette bavette de flanchet au chutney d’oignons! Imprimer Épingler la recette 5 de 6 votes Bavette de flanchet au chutney d’oignons Temps de préparation10 minutes min Temps de cuisson15 minutes min Type de plat: Plat principal Mots-clés: bavette, boeuf, moutarde, oignons, sirop d’érable, viande Portions: 4 Ingrédients 4 bavettes de flanchet1 bel oignon jaune (ou 2 petits)1 filet d'huile d'olive2 cs de vinaigre de cidre1 cs de moutarde40 ml de sirop d'érablesel, poivre InstructionsPréparer le chutney d'oignons:Peler et émincer les oignons.Dans une casserole, les faire revenir dans un filet d'huile d'olive à feu moyen pendant 7-8 min. Déglacer avec le vinaigre puis ajouter la moutarde et le sirop d'érable. Poursuivre la cuisson 2-3 min.Pendant ce temps, faire cuire les bavettes:Dans une poêle, faire chauffer un filet d'olive et saisir les bavettes des deux côtés à feu vif. Baisser un peu le feu et poursuivre la cuisson jusqu'à la cuisson souhaitée. Saler et poivrer.Retirer du feu et conserver les bavettes dans une assiette sous un papier d'aluminium.Déglacer la poêle avec un petit d'eau et gratter les sucs de cuisson pour obtenir un jus.Servir les bavettes nappées et de jus avec le chutney d'oignons. Une autre idée de sauce pour accompagner la bavette: une savoureuse sauce à l’échalote.",1,1
"Ingrédients : Pour 4 personnes Moussaka 4 belles aubergines 500g d’épaule agneau hachée 1 oeuf 1 oignon 1 gousse d’ail 1càc d’origan 1 boite tomates concassées Huile d’olive 1cac Parmesan Béchamel 250ml lait 60g farine 1 pincée noix de muscade Coulis de tomates 4 belles tomates 1/2 oignon haché 1 gousse d’ail 1 càc d’origan, thym sel, poivre Huile d’olive Préparation • Coupez les aubergines en tranches minces et disposez-les dans une passoire. • Saupoudrez les de sel pour les faire dégorger et ce pendant 30 min puis • Essuyez-les bien. Réservez. La farce : • Dans une cocotte chauffez 3 c à s d’huile d’olive et • Faites revenir l’ail et l’oignon puis • Ajoutez l’agneau et laissez cuire à feu vif en remuant jusqu’à ce qu’il soit doré. •Incorporez la farine, les tomates concassées, l’origan et le thym, assaisonnez. • Portez à ébullition et laissez frémir 20 min. • Battez l’œuf puis ajoutez-le à la viande légèrement refroidie. • Dans une autre grande poêle faites chauffer l’huile et • Faites dorer les tranches d’aubergines une à une et • Déposez les sur du papier absorbant. Réservez. Coulis de tomates : • Pendant ce temps préparez le coulis de tomate. • Faites revenir l’oignon haché dans 1 c à s d’huile d’olive. • Lavez les tomates, coupez-les en morceaux. • Faites chauffer 2 c à s d’huile d’olive dans une sauteuse, ajoutez les tomates, le thym et • Faites-les compoter sur feu doux pendant 10 min. Salez, poivrez et laissez tiédir. La béchamel : • Faites fondre le beurre dans une casserole, ajoutez la farine et • Remuez pendant 2 minutes toujours sur le feu. • Versez ensuite le lait froid et mélangez jusqu’à de façon à obtenir un appareil homogène. • Ajoutez la pincée de noix de muscade râpée, et le fromage. • Rectifiez l’assaisonnement si nécessaire. Préchauffez le four à 180°C Montage de la charlotte : • Dans un moule à charlotte où à manqué, disposez les tranches d’aubergine en formant une rosace en les superposant légèrement en tournant dans le sens des aiguilles d’une montre. • Placez la point au centre du moule et laissez légèrement dépasser les tranches. • Disposez la moitié de la farce au fond du moule, recouvrez de la béchamel puis des tranches d’aubergines. •Terminez avec le restant de farce. Rabattez les aubergines qui tapissent le moule vers l’intérieur, puis • Fermez avec les tranches d’aubergines. Tassez pour obtenir quelque chose de plat. • Déposez la charlotte dans un plat allant au four que vous aurez rempli au 3/4 d’eau et faites cuire au bain-marie environ 45 min. • Démoulez ensuite la charlotte, décorez un brin de basilic et servez avec le coulis de tomates. Enjoy!",1,1
"Ingrédients poivre sel muscade cumin curry 8 cuillères à soupe de fécule de maïs gingembre 2 carottes 1 poireau 100 g de lentilles corail 100 g de riz complet 150 g de boulgour 1 oignon rouge 100 g de champignons de Paris 50 g de concentré de tomates herbes de Provence Voir plus Voir moins En cliquant sur les liens, vous pouvez être redirigé vers d’autres pages de notre site, ou sur Amazon.fr La suite après cette publicité Ustensiles 1 Cuillère en bois Les meilleures ventes Acheter 1 sauteuse Top 3 des sauteuses + de détails 1 Set 3 poêles Notre sélection des meilleures poêles + de détails 1 Couteau Top des meilleurs couteaux de cuisine + de détails 1 saladier Les meilleures ventes Acheter 1 Four top des meilleurs fours + de détails 1 Top des meilleures plaques à four plaque à four + de détails 1 plaque de cuisson + de détails 1 Spatule Top des meilleures spatules + de détails 1 congélateur + de détails 1 Micro-ondes Le top des micro-ondes + de détails 1 dénoyauteur Les meilleures ventes Acheter Voir plus Voir moins En cliquant sur les liens, vous pouvez être redirigé vers d’autres pages de notre site, ou sur Amazon.fr Préparation Temps total : 1h05 Préparation : 20 min Repos : - Cuisson : 45 min Étape 1 Mélanger les lentilles, le riz complet et le boulghour et les faire cuire 15 à 20 min à l'eau bouillante. Egoutter. Étape 2 Emincer l'oignon, les carottes, le poireau, les champignons et le gingembre. Faire revenir les légumes à la sauteuse 15 min avec un peu d'huile d'olive jusqu'à ce qu'ils soient bien tendres. Étape 3 Mélanger ensuite les légumes et les céréales dans un saladier, puis ajouter la fécule de maïs (qui servira de liant du tout). Mélanger et ajouter le concentré de tomates, et bien remuer. Enfin, ajoutez les épices, il ne faut pas hésiter à en mettre pour que le tout ait beaucoup de goût. J'utilise en général une cuillère à café de curry, 1/2 de cumin moulu, 3 pincée d'herbes de Provence, 1/3 de noix de muscade et du sel et du poivre. Bien mélanger jusqu'à avoir une pâte bien liée qui se tient bien. Étape 4 Enfin, disposer la préparation sur une plaque de cuisson en forme ronde / ovales d'environ 1cm d'épaisseur. Essayer de tasser le tout pour que le steak se tienne bien après cuisson. Enfourner les steaks pour 15 min au four. Une fois dorés sur la face supérieure, les retourner avec une spatule (ils devraient normalement être assez durs / rigides). Réenfourner pour 5 min afin qu'ils grillent sur l'autre face. Étape 5 Voilà, c'est prêt ! A déguster dans un hamburger ou seul... ! Il est possible de les stocker au congélateur et de les faire revenir rapidement à la poêle ou au micro-ondes au dernier moment. e etiennedefqvx",1,1
"Ingrédients huile de friture (traditionnellement, les frituriers belges utilisent du blanc de bœuf, parfois additionné de graisse de porc ou de mouton, ce qui donne ce goût particulier aux 'frites de friture', mais je préfère de loin l’huile, les frites étant alors plus légères et plus digestes ; toutes les chaînes de distribution commercialisent de bonnes huiles pour friture, qui se valent à peu près 1 kg de pomme de terre de type Bintje Voir plus Voir moins En cliquant sur les liens, vous pouvez être redirigé vers d’autres pages de notre site, ou sur Amazon.fr La suite après cette publicité Ustensiles 1 friteuse + de détails 1 Couteau Top des meilleurs couteaux de cuisine + de détails En cliquant sur les liens, vous pouvez être redirigé vers d’autres pages de notre site, ou sur Amazon.fr Préparation Temps total : 20 min Préparation : 10 min Repos : - Cuisson : 10 min Étape 1 Peler les pommes de terre et les laver, puis les détailler en parallélépipèdes à base carrée d’environ 1,5 cm de côté (en d’autres termes, en grosses frites). Les laver à nouveau et bien les sécher dans un torchon à vaisselle propre. Étape 2 Les faire cuire une première fois dans l’huile chauffée à 150°C, pendant 7 à 8 minutes. Il ne faut pas surcharger la friteuse: pour 1 kg de pommes de terre, cuire 1/3 des frites à la fois. Étape 3 Laisser refroidir les frites, le temps de prendre l’apéro ou de préparer le reste du repas. Étape 4 Cuire les frites une seconde fois dans l’huile chauffée à 190°C pendant environ 3 mn (elles doivent être croustillantes sans être dures). Étape 5 Servir les frites aussitôt, accompagnées d’une salière: je déconseille de les saler à l’avance, car, d’une part, les frites ramollissent alors, et d’autre part, je n’aime pas le sel sur les frites (comme ça, chacun sale comme il vaut). A Anonyme Note de l'auteur : « Les bonnes frites de chez nous furent l’accompagnement quotidien des repas de mon papa, qui leur doit malheureusement des artères bien bouchées... Je dois donc conseiller de consommer avec modération ce parangon de la cuisine belge. A propos de frites, coupons les ailes à deux canards : - contrairement à leur dénomination américaine de french fries, qui suggère une origine française, les pommes de terre frites sont bien d’origine belge: l’on se rappellera que la pomme de terre a été importée en Europe par les conquistadores, qui en avaient fait la connaissance dans les Amériques, et elle se répandit immédiatement dans tout le monde espagnol. Or en ce temps-là, la Belgique, qui faisait partie de l’empire de Charles-Quint, était espagnole (elle était d’ailleurs alors dénommée Pays-Bas Espagnols). L’usage de la pomme de terre se répandit donc en Belgique plus d’un siècle avant que Parmentier ne l’introduise en France, et les noms courants qu’elle y porte restent le signe de son origine: patate, de l’espagnol batata (lui-même dérivé d’un nom indien semblable), nom qui plus précisément devrait désigner la patate douce, tubercule proche par la forme de la pomme de terre; Canada, nom qui réalise l’union de l’Amérique lointaine et de la francophonie si chère au cœur des wallons; crompire, de l’allemand krumpire (poire de terre), parce que Charles-Quint était tout à la fois souverain d’Espagne et Empereur d’Allemagne (la principauté de Liège est d’ailleurs restée membre du Saint Empire Romain Germanique jusqu'à l’époque de la révolution française). Le lecteur attentif objectera que, s’il est ainsi établi que les pommes de terre ont été connues des belges bien avant que leurs voisins français n’en fissent leur ordinaire, cela n’établit pas l’origine de la frite elle-même... C’est là qu’intervient la tradition orale (ou, selon certain, la légende), fondement habituel des prétentions chauvines: il était à Namur une coutume selon laquelle on se régalait de petits poissons frits, pour célébrer les dons que la Meuse faisait à ses fils et filles. Or il advint que les petits poissons vinrent, vinrent, vinrent à manquer. Les namurois, ingénieux comme de coutume, eurent l’idée de les remplacer par des morceaux de pommes de terre de forme semblable, qu’ils firent frire. La frite était née et nul n’imaginait alors que, par l’entremise intéressée de Messieurs Mac Donald, Quick et autres Colonel Sanders, elle partirait quelques siècles plus tard à la conquête du monde en accompagnement obligatoire de viande hachée et de poulet reconstitué. Jusqu’il y a une vingtaine d’années, les édicules où oeuvraient frénétiquement les spécialistes de la confection et de la distribution des frites portaient fièrement, en Belgique francophone, le nom de friture, et en flandre le nom de frituur, ce qui était à la fois typique et pratique, le belge se déplaçant dans une autre région que la sienne pouvant aisément savoir où se procurer ce qui est, en définitive et avec la monarchie depuis Albert Ier, le seul ciment de la belgitude. Etait-ce pour bannir tout régionalisme dans le parler de chez nous (ces beaux mots de mon enfance que le maître d’école soulignait en rouge avec la mention marginale 'belgicisme!', le traître), ou pour définitivement empêcher qu’un même concept puisse être recouvert par un mot de même prononciation en français et en flamand, ce qui mettait manifestement en péril le fragile équilibre de l’état fédéral belge et de ses communautés culturelles, toujours est-il qu’il fut déclaré urbi (bruxelli) et orbi que le terme friture ne pouvait désigner qu’une assiettée de poisson dégoulinant de graisse chaude et malodorante, et que les baraques à frites seraient désormais dénommées, pompeusement mais correctement, friteries. Loin de moi l’idée de contrecarrer cet assaut de correction linguistique, après tout phénomène rare dans les préoccupation des représentants de la nation et de tout qui incarne la conscience du peuple, mais je constate que l’Encyclopédie Larousse donne, pour le mot friture, la définition, entre autres, de baraque à frites, et que même Littré (que je ne soupçonne pas d’avoir utilisé les pages de ses invendus à faire des cornets) reconnaît pour friture l’établissement où l’on prépare des sardines à l’huile (ce qui prouve indubitablement la réalité de la légende namuroise citée ci-avant, le grand lexicologue persistant à confondre pommes de terres frites et petits poissons à l’huile). Bref, cependant que les wallons s’obstinaient à bannir de leur vocabulaire le terme friterie pour être de bon bec (qui n’est que de Paris), les détenteurs de l’authenticité francophone l’adoptaient. Lè-y’m ploré! » La suite après cette publicité Découvrez l’accord Mets & Vins parfait avec Voir la sélection En partenariat avec Tanin.fr Qu'est-ce qu'on mange ce soir ? De l'inspiration chaque jour avec des recettes faciles, gourmandes et de SAISON :)",1,1
"Ingrédients 15 cl de vin rouge 30 g de sucre 1 étoile de badiane 3 grains de poivre noir 2 clous de girofle 3 goutte(s) d'extrait de vanille 500 g de fraises un peu de zeste de citron vert bio Préparation Dans une petite casserole, portez le vin rouge à ébullition. Hors du feu, ajoutez le sucre, la badiane, les grains de poivre noir, les clous de girofle. Laissez infuser 10 mn, puis ajoutez 3 gouttes d’extrait de vanille et 15 cl d’eau froide. Réservez le tout au frais. Équeutez les fraises et coupez-les en deux, répartissez-les dans 4 coupelles. Versez le sirop au vin, ajoutez un peu de zeste d’un citron vert bio et servez immédiatement.",1,1
"Ingrédients sel poivre huile d'olive vinaigre de vin (1 cuillère à soupe) vinaigre balsamique (3 cuillères à soupe) thym 4 courgettes (jaunes ou vertes) 1 gousse d' ail violet Voir plus Voir moins En cliquant sur les liens, vous pouvez être redirigé vers d’autres pages de notre site, ou sur Amazon.fr La suite après cette publicité Ustensiles 1 économe Top 5 des meilleurs économe + de détails 1 couteau Top 3 des couteaux + de détails 1 saladier Les meilleures ventes Acheter 1 Cuillère en bois Les meilleures ventes Acheter 1 Frigo Top des meilleurs réfrigérateurs + de détails 1 Couvercle Les meilleures ventes Acheter Voir plus Voir moins En cliquant sur les liens, vous pouvez être redirigé vers d’autres pages de notre site, ou sur Amazon.fr Préparation Temps total : 10 min Préparation : 10 min Repos : - Cuisson : - Étape 1 - Ne pas éplucher les courgettes. Étape 2 Les couper en 2 (dans la longueur) et ôter les graines centrales. Étape 3 Avec un économe, faire de fines lamelles toujours dans le sens de la longueur. Étape 4 - Dans un saladier, mélanger: vinaigre,huile, ail, sel, poivre et thym. Étape 5 Ajouter les courgettes. Étape 6 Couvrir et mettre au frais au moins 15 min. s sandykilo",1,1
"Ingrédients 2 petites aubergines 3 artichauts violets 4 petits oignons rouges 1 betterave jaune crue 2 petites courgettes rondes jaunes 350 g de tomates mûres 8 petites pommes de terre le jus de 1/2 citron 180 g de feta 1 yaourt grec 1/2 botte de basilic huile d'olive sel, poivre Préparation Préchauffez le four à 180 °C (th. 6). Rincez tous les légumes. Versez le jus de citron dans un saladier d’eau froide. Coupez les aubergines (avec la peau) en petits morceaux et placez-les dans le saladier. Arrachez les grosses feuilles des artichauts et coupez le bout des tiges. Coupez chaque artichaut en deux, retirez le foin et plongez-les dans le saladier. Épluchez et coupez les oignons en deux. Tranchez la betterave en fines lamelles. Coupez les courgettes en petits morceaux (en gardant la peau). Versez un filet d’huile d’olive sur une plaque. Disposez-y les légumes – les tomates restent entières – après avoir égoutté l’aubergine et les artichauts. Parsemez le tout de 110 g de feta en gros morceaux. Versez un filet d’huile d’olive. Salez et poivrez. Mélangez et enfournez 35 à 40 mn. Mixez le yaourt, le reste de feta et les feuilles de basilic. Salez et poivrez, dégustez tout de suite ou réservez au frais jusqu’au moment de servir.",1,1
"Ingrédients sel poivre huile d'olive 2 concombres chèvre très frais herbes de Provence ciboulette échalote Voir plus Voir moins En cliquant sur les liens, vous pouvez être redirigé vers d’autres pages de notre site, ou sur Amazon.fr La suite après cette publicité Ustensiles 1 Four top des meilleurs fours + de détails 1 saladier Les meilleures ventes Acheter 1 fourchette + de détails 1 Cuillère en bois Les meilleures ventes Acheter 1 couteau Top 3 des couteaux + de détails 1 économe Top 5 des meilleurs économe + de détails 1 dénoyauteur Les meilleures ventes Acheter Voir plus Voir moins En cliquant sur les liens, vous pouvez être redirigé vers d’autres pages de notre site, ou sur Amazon.fr Préparation Temps total : 5 min Préparation : 5 min Repos : - Cuisson : - Étape 1 Dans un grand saladier, mélanger à la fourchette le chèvre, l'huile d'olive, les herbes et le reste de l'assaisonnement. Étape 2 Eplucher les concombres, puis les couper dans le sens de la longueur en lamelles très fines à l'aide d'un épluche-légumes (s'arrêter avant les pépins du centre). Étape 3 Mélanger le tout. c camila_14097050",1,1
FAUX POSITIFS, , 
"Ingrédients 2 cuillères à soupe d' huile d'olive 0.5 cuillère à café de poivre noir 0.5 cuillère à café de sel 0.5 cuillère à café de gingembre moulu 2 cuillères à café de cumin 0.5 cuillère à café de piment de Cayenne 0.5 cuillère à café de muscade 30 g de noix 1 oignon 250 g de champignon 2 gousses d' ail finement hachées sans le germe 25 g d' amandes 25 g de noisettes 120 g de noix de cajou 150 g de chapelure complète 2 cuillères à café de farine complète 1 cuillère à café de paprika 35 feuilles de coriandre finement ciselées 25 cl d' eau Voir plus Voir moins En cliquant sur les liens, vous pouvez être redirigé vers d’autres pages de notre site, ou sur Amazon.fr La suite après cette publicité Ustensiles 1 Mixeur Les meilleures ventes Acheter 1 pôele Le top des poêles + de détails 1 friteuse + de détails 1 bol Top des saladiers + de détails 1 Cuillère en bois Les meilleures ventes Acheter 1 dénoyauteur Les meilleures ventes Acheter 1 balance de cuisine Top des meilleures balances + de détails Voir plus Voir moins En cliquant sur les liens, vous pouvez être redirigé vers d’autres pages de notre site, ou sur Amazon.fr Préparation Temps total : 20 min Préparation : 20 min Repos : - Cuisson : - Étape 1 D'abord, préparer tous les ingrédients. Passer les champignons au mixeur et les mettre en petit bouts, gros comme des haricots secs. Faire pareil avec l’oignon et le mettre directement dans une grande poêle, parce qu'on va le frire plus tard. Passer les noix au mixeur et les mettre en morceaux aussi : grosseur d'un demi haricot sec :) Étape 2 Dans un bol, mettre la chapelure, la farine et les épices. Étape 3 Sur feu vif, faire frire l'oignon dans l'huile d'olive jusqu'à ce qu'il prenne une belle couleur. Étape 4 Ajouter les champignons et les faire revenir. Ils vont dégager de l'eau et l'eau va s'évaporer. Étape 5 Ajouter l'ail et faire revenir. Étape 6 Ajouter l'eau et le contenu du bol d'épices que vous avez préparé. Bien remuer l'ensemble et enlever la poêle du feu. Étape 7 Voilà, vous avez de la chair fraîche. Y Yum_Yum",0,1
