regime,valeur réelle,valeur prédite
VRAIS POSITIFS, , 
"Let’s go en cuisine pour préparer ces croquettes de thon aux herbes! Imprimer Épingler la recette 5 de 4 votes Croquettes de thon aux herbes Temps de préparation15 minutes min Temps de cuisson15 minutes min Type de plat: Apéritif, Entrée Mots-clés: aneth, coriandre, croquettes, persil, piment jalapeño, thon Portions: 15 Ingrédients 3 oeufs3 cs de farine350 g de thon (poids net égoutté)1 échalote1 piment jalapeño1 citron vertquelques brins de persilquelques brins d'anethquelques brins de coriandresel, poivrede l'huile de tournesol pour la cuisson InstructionsDans un saladier, mélanger les oeufs avec la farine.Ajouter le thon émietté, l'échalote et le piment taillés en tout petits dés, les herbes ciselées, le zeste finement râpé du citron, du sel et du poivre.Façonner des croquettes en vous aidant de deux cuillères à soupe (ou alors faire des boules aplaties directement avec les mains).Faire chauffer un fond d'huile dans une grande poêle à environ 170°. Faire cuire les croquettes en les retournant dans l'huile.Egoutter sur du papier absorbant.Servir avec une petite sauce au fromage blanc, ail et fines herbes et un filet de jus du citron.",1,1
"Ingrédients 50 g de fraises 4 cuillère(s) à soupe d'huile d'olive 1 cuillère(s) à soupe de vinaigre balsamique 100 g de roquette 2 tranches de jambon cru type jambon de Parme 4 brins de basilic Préparation Rincez les fraises rapidement sous l’eau froide et équeutez-les. Mixez la moitié des fraises avec l’huile d’olive, le vinaigre balsamique, une pincée de sel et une pincée de poivre noir. Dans un saladier, mélangez l’autre moitié des fraises coupées en grosses rondelles avec la roquette et les tranches de jambon déchirées en petites lanières, parsemez de basilic lavé et ciselé. Servez avec la vinaigrette à la fraise.",1,1
"Ingrédients : Pour 4 personnes 250 g de pâte à Pizza Pâte 350 g farine 2 c à c sel 15 g levure boulangère fraiche 3 c à s huile d’olive 25 cl d’eau tiède 150 g de fraises 100 g de mascarpone 2 brins de romarin Préparation de la pizza aux fraises et mascarpone Préparation : 15 mn Pause levée de la pâte : 20 mn Cuisson : 20 mn . • Dans le bol du robot, mettez la farine, puis le sel, la levure de boulanger émiettée et l’huile d’olive . • À l’aide de l’outil crochet mélangez et • Ajoutez l’eau progressivement jusqu’à obtenir une pâte qui se détache des parois. • Couvrez d’un torchon • Laissez reposer la pâte pendant 30 mn environ • Vous obtenez environ 500 g de pâte. • Dégazez la pâte avec la paume de la main et • Divisez la en deux parties égales de 250 g environ. Vous pouvez congeler le 2e pâton. • Préchauffez le four à 200°C • Façonnez la pâte en un ovale • Répartissez le mascarpone sur la pâte à l’aide d’une spatule • Déposez les fraises coupées en morceaux • Parsemez de cassonade et de romarin • Enfournez pendant 15 min à 20 mn jusqu’à ce que la pâte soit dorée. • Dégustez chaud ou froid et régalez-vous. • Une pizza sucrée originale et tout à fait délicieuse. . Source : magazine Saveurs .",1,1
"Let’s go en cuisine pour préparer cette brioche sans oeuf! Imprimer Épingler la recette 4.20 de 5 votes Brioche sans oeuf Une brioche toute moelleuse Temps de préparation10 minutes min Temps de cuisson25 minutes min Temps de repos de la pâte2 heures h Type de plat: Petit déjeunerCuisine: Française Mots-clés: brioche Matériel nécessaireThermomix ou robot pâtissier Ingrédients 500 g de farine320 g de lait 75 g de sucre2 cc de levure de boulanger sèche100 g de beurredu lait pour la dorureun peu de sucre perlé et de pépites de chocolat InstructionsDans le bol du thermomix, placer la farine, le lait, le sucre et la levure.Pétrir 5 min en fonction épi.Ajouter le beurre en morceaux.Pétrir encore 5 min.Laisser la pâte doubler de volume dans le bol fermé (ou débarrasser la pâte dans un saladier et couvrir).Dégazer la pâte et façonner la brioche.La placer dans un moule à cake ou directement sur la plaque couverte d'une feuille de cuisson.Laisser de nouveau doubler de volume.Préchauffer le four à 180° (chaleur tournante).Badigeonner la brioche de lait avec un pinceau et saupoudrer de sucre perlé et de pépites de chocolat.Enfourner et laisser cuire 25 min.",1,1
"Ingrédients Ingrédient incontournable 50 g de pépites de chocolat extrait de vanille liquide (quelques gouttes) 1 cuillère à soupe de noix de coco rapée 4 bananes s 80 g de flocons d'avoine Voir plus Voir moins En cliquant sur les liens, vous pouvez être redirigé vers d’autres pages de notre site, ou sur Amazon.fr La suite après cette publicité Ustensiles 1 Four Top des meilleurs fours + de détails 1 saladier Les meilleures ventes Acheter En cliquant sur les liens, vous pouvez être redirigé vers d’autres pages de notre site, ou sur Amazon.fr Préparation Temps total : 25 min Préparation : 10 min Repos : - Cuisson : 15 min Étape 1 Préchauffer le four à 180°C. Étape 2 Écraser les bananes dans un saladier. Étape 3 Ajouter les flocons d'avoine, la noix de coco, l'extrait de vanille et les pépites de chocolat. Étape 4 A l'aide d'une cuillère (à thé par exemple), poser des boules de pâtes sur une plaque recouverte de papier sulfurisé. Étape 5 Cuire à 180°C pendant 15 minutes pour des cookies moelleux («chewy»), ou 20 minutes pour des cookies plus croustillants. j julia_19261668",1,1
"Ingrédients 200 g de chocolat noir ou lait 75 g de beurre ou 50 g si chocolat au lait 100 g de pétales de maïs (ou autres céréales soufflées au choix : quinoa, riz…) billes en sucre ou vermicelles en chocolat Préparation Faites fondre au bain-marie 200 g de chocolat noir avec 75 g de beurre ou 200 g de chocolat au lait avec 50 g de beurre. Lissez le mélange à la spatule. Retirez du feu et ajoutez les pétales de maïs (ou autres céréales soufflées au choix : quinoa, riz…) puis mélangez. Prélevez des cuillerées de chocolat aux céréales et déposez-les dans des caissettes en papier. Décorez de billes en sucre ou de vermicelles en chocolat. Laissez prendre 2 h au réfrigérateur. Consommez rapidement.",1,1
"Ingrédients 300 g de carottes 2 oignons 350 g de lentilles corail coriandre moulue curcuma moulu cumin moulu gingembre moulu noix de muscade moulue 500 g de tomates pelées en conserve bouillon de légumes feuilles de coriandre sel, poivre du moulin huile d'olive graines de sésame feuilles de cerfeuil Préparation Pelez les carottes et coupez-les en rondelles. Pelez et émincez les oignons. Rincez les lentilles corail. Versez dans une casserole 2 cuil. à soupe d’huile d’olive, ajoutez les oignons et faites cuire 5 mn à feu moyen, jusqu’à ce qu’ils soient translucides. Ajoutez les carottes, 1 cuil. à café de coriandre, 1 cuil. à soupe de curcuma, 1 cuil. à soupe de cumin, 2 cuil. à café de gingembre et 1 cuil. à café de noix de muscade. Poursuivez la cuisson pendant 5 mn. Incorporez les lentilles corail, les tomates pelées avec leur jus et 1,6 l de bouillon. Portez à ébullition, baissez le feu, puis laissez mijoter 20 mn à feu doux. Ajoutez quelques feuilles de coriandre et mélangez. Versez la préparation dans le bol d’un blender puis mixez jusqu’à obtenir une texture lisse et homogène. Salez, poivrez. Versez la soupe dans des bols, saupoudrez de graines de sésame et de feuilles de cerfeuil.",1,1
"Ingrédients 125 g de framboises 10 g de sucre 2 cuillères à soupe d' eau 150 g de tofu soyeux 50 g de farine de riz 20 cl de lait d'avoine 15 g de sirop d'érable Voir plus Voir moins En cliquant sur les liens, vous pouvez être redirigé vers d’autres pages de notre site, ou sur Amazon.fr La suite après cette publicité Ustensiles 1 casserole + de détails 1 cuillère en bois + de détails 1 fouet + de détails 1 four + de détails 1 Balance de cuisine + de détails Voir plus Voir moins En cliquant sur les liens, vous pouvez être redirigé vers d’autres pages de notre site, ou sur Amazon.fr Préparation Temps total : 1 h Préparation : 20 min Repos : - Cuisson : 40 min Étape 1 Préparer la confiture de framboise : laver délicatement les framboises, puis les verser avec l’eau et le sucre dans une petite casserole. Faire chauffer à feu doux en remuant avec une cuillère en bois et laisser compoter. Une fois la texture souhaitée obtenue, mettre de côté et laisser refroidir. Étape 2 Fouetter le tofu jusqu’à obtenir une texture crémeuse. Étape 3 Ajouter la farine, puis le lait végétal et le sirop d’érable. Mélanger au fouet jusqu’à obtenir une texture lisse sans grumeaux. Étape 4 Remplir les moules à moitié, ajouter deux cuillères à café de confiture au centre de chaque moule et recouvrir avec le reste de pâte. Mélanger délicatement pour faire apparaître des volutes. Étape 5 Faire cuire 40 minutes au four à 180°C (thermostat 6).",1,1
"Ingrédients coriandre fraîche curry 1 tomate , enlever pulpe, hacher chaire 1 piment frais haché (attention au piment, lavez-vous les mains en frottant les ongles une fois haché !) 1 oignon 1 courgette en petits cubes pincée de sel 3 cuillères à soupe d' huile d'olive 200 g de farine bise (ou 50 g de farine complète + 150 g de farine blanche) 200 g de tofu ferme nature en petits cubes 2 gousses d' ail Voir plus Voir moins En cliquant sur les liens, vous pouvez être redirigé vers d’autres pages de notre site, ou sur Amazon.fr La suite après cette publicité Ustensiles 1 saladier Les meilleures ventes Acheter 1 Cuillère en bois Les meilleures ventes Acheter 1 Set 3 poêles Notre sélection des meilleures poêles + de détails 1 couteau Top 3 des couteaux + de détails 1 Rouleau à pâtisserie Top des meilleurs rouleaux à pâtisserie + de détails 1 Four Top des meilleurs fours + de détails 1 fourchette + de détails 1 presse agrume + de détails 1 planche à découper Top des meilleures planches à découper + de détails 1 dénoyauteur Les meilleures ventes Acheter 1 balance de cuisine Top des meilleures balances + de détails Voir plus Voir moins En cliquant sur les liens, vous pouvez être redirigé vers d’autres pages de notre site, ou sur Amazon.fr Préparation Temps total : 1h40 Préparation : 1 h Repos : - Cuisson : 40 min Étape 1 Préparer la pâte : mélanger la farine, le sel et l'huile d'olive jusqu'à obtention mélange sableux. Étape 2 Ajouter graduellement de l'eau (environ 20 cl) jusqu'à pouvoir former une boule lisse. Laisser reposer. Étape 3 Préparer la farce : émincer l'ail et l'oignon, puis les faire revenir avec le piment, puis ajouter tofu et remuer 5 min. Étape 4 Ajouter tomate et courgette, sel, poivre, curry (préférez du curry de madras ou du curry doux, pour résultat plus relevé forcez le piment). Étape 5 Laisser cuire 5 min, les courgettes doivent rester croquantes. Retirez du feu, ajouter coriandre hachée, laisser bien refroidir. Étape 6 Là, ça se complique... :) Pour former des ronds de pâte de 8cm de diamètre, abaisser des petites quantités de pâte pour former des ronds approximativement de la bonne grandeur, puis découper la forme exacte avec un emporte-pièce ou simplement avec un récipient du bon diamètre et un couteau. Étape 7 Répartir la farce dans chaque rond en laissant suffisamment de bords pour pouvoir refermer en pliant en 2. Bien presser les bords ensemble, petits trous à la fourchette sur le dessus. Étape 8 Cuire à four chaud (180 à 200°C) pour éviter que le dessous soit tout mou... 10 min pile, 15 min face, 10 à 15 min dernier tour en badigeonnant légèrement le dessus à l'oeuf. Étape 9 Voilà, faut avoir le temps, pour végétariens patients... Version viande hachée délicieuse aussi cela dit! a agathe_16616940",1,1
"Ingrédients 1 cuillère à soupe d' huile végétale 1 cuillère à soupe d' épices tex mex 1 pincée de poivre 1 pincée de sel 1 cuillère à soupe de fécule de maïs 100 g de tofu nature 2 cuillères à soupe d' eau 30 g de chapelure Voir plus Voir moins En cliquant sur les liens, vous pouvez être redirigé vers d’autres pages de notre site, ou sur Amazon.fr La suite après cette publicité Ustensiles 1 Cuillère en bois Les meilleures ventes Acheter 1 saladier Les meilleures ventes Acheter 1 couteau Top 3 des couteaux + de détails 1 pôele Le top des poêles + de détails 1 assiette + de détails 1 assiette creuse + de détails Voir plus Voir moins En cliquant sur les liens, vous pouvez être redirigé vers d’autres pages de notre site, ou sur Amazon.fr Préparation Temps total : 20 min Préparation : 10 min Repos : - Cuisson : 10 min Étape 1 Dans une assiette creuse, mélanger l’eau et la fécule de maïs jusqu’à obtenir une texture collante mais pas trop épaisse. Étape 2 Dans une seconde assiette creuse, verser la chapelure et l’assaisonner : sel, poivre, épices. Étape 3 Couper le tofu en tranches d’environ 3-4 mm d’épaisseur. Le tremper dans le mélange eau-fécule, puis dans la chapelure. Répéter l’opération pour toutes les tranches de tofu. Étape 4 Faire cuire le tofu dans une poêle huilée pendant environ 10 minutes (5 minutes sur chaque face). N’hésitez pas à ajouter de l’huile pour que la chapelure soit bien colorée ! h hannah_14402351",1,1
"La recette : Pour 6 personnes : 2 bons kilos de poivrons rouges pour obtenir 500g net de chair une fois pelés épépinés et égouttés, 2 sachets d’aubergines pré frites surgelées Picard, 200g de crème épaisse, 4 œufs, graines de cumin, sel, poivre, 2 petits fromages de chèvre mi frais, fleur de sel, piment d’Espelette, huile d’olive. La veille si possible : faites griller* les poivrons. Enfermez-les dès la sortie du four dans un sac plastique, laissez-les refroidir puis pelez-les, épépinez-les et égouttez-les soigneusement dans une passoire. Mixez-les ensuite avec les œufs et la crème. Assaisonnez à convenance. Selon votre choix de présentation, huilez légèrement des ramequins individuels*. Détaillez à l’emporte pièce des cercles dans les tranches d’aubergines non dégelées. Posez au fond des moules une rondelle d’aubergine parsemez généreusement* de graines de cumin, ajoutez une couche de crème de poivrons, puis à nouveau une rondelle d’aubergine, du cumin, terminez par la crème de poivrons et faites cuire au bain-marie à 180° 50mn à 1 heure à vérifier. Démoulez les flans et servez-les froids accompagnés de lamelles de fromage de chèvre frais assaisonnées de piment d’Espelette et de fleur de sel. Décorez l’assiette selon l’inspiration du moment.",1,1
"Ingrédients 2 bottes de radis roses 200 g de gruyère ou de comté Voir plus Voir moins En cliquant sur les liens, vous pouvez être redirigé vers d’autres pages de notre site, ou sur Amazon.fr La suite après cette publicité Ustensiles 1 Couteau Top des meilleurs couteaux de cuisine + de détails 1 plat + de détails En cliquant sur les liens, vous pouvez être redirigé vers d’autres pages de notre site, ou sur Amazon.fr Préparation Temps total : 30 min Préparation : 30 min Repos : - Cuisson : - Étape 1 Equeuter et laver les radis, puis les couper en rondelles. Étape 2 Couper le gruyère en petits dés. Étape 3 Placer les deux dans un plat et ajouter une vinaigrette bien relevée. s sarah_14279016",1,1
"Ingrédients 2 gros filets de daurade (2,2 kg) fleur de sel poivre noir sarawak huile d'olive de première pression provence fruitée verte pour le jus acidulé 3/4 d'un petit piment vert long (auquel on a retiré les pépins) le zeste de 1 citron vert le zeste de 1/4 d'orange 1 càc de sel fin 30 g de gingembre frais 46 goutte(s) de tabasco 180 g de jus de citron vert frais pressé 100 g de jus d'orange orange frais pressé pour la finition 1/2 oignon rouge coupé 4 radis roses 1/2 botte de coriandre Préparation Préparez le jus acidulé : râpez le gingembre et les zestes d’agrumes très finement. Épépinez le piment et tranchez-le très fin. Mélangez tous les ingrédients, gardez au frais. Vérifiez l’assaisonnement. Pelez et coupez les oignons en très fines lamelles. Faites les tremper 2 h dans un bol d’eau froide. Émincez les radis en fines lamelles. Lavez et effeuillez la coriandre et réservez le tout au frais. A l’aide d’un couteau très bien affûté, émincez le poisson à l’horizontale, en fines lamelles et disposez-le sur les assiettes. Filmez et réservez au frais. Au moment de servir, égouttez les oignons. Sortez les assiettes, ôtez le film et versez le jus pimenté de manière à ce qu’il assaisonne la chair du poisson. Salez et poivrez généreusement. Versez un peu d’huile pour assaisonner. Répartissez les oignons sur le poisson, recouvrez de feuilles de coriandre et de lamelles de radis. Dégustez très très frais.",1,1
"Ingrédients 160 g de graines de sarrasin 400 g de potimarron cru épluché 2 oignons blancs 2 cuillère(s) à soupe d'huile d'olive vierge extra 1 cube de bouillon de légumes 6 cl de lait de coco curry (à l'envi) cumin (à l'envi) sel, poivre Préparation Rincez les graines de sarrasin sous un filet d’eau froide. Pelez et coupez le potimarron en dés de taille moyenne, pelez et taillez les oignons en dés. Faites chauffer dans une poêle l’huile d’olive et faites-y dorer les oignons. Ajoutez les graines de sarrasin et faites-les sauter 1 mn en mélangeant bien, afin que chaque grain s’imprègne du reste d’huile issue de la cuisson des oignons. Diluez un cube de bouillon dans 300 ml d’eau chaude. Versez dans la poêle les dés de potimarron et le bouillon chaud. Assaisonnez de curry, de cumin et faites cuire à couvert pendant 15 mn à feu moyen (n’hésitez pas à ajouter davantage d’eau si les graines de sarrasin collent à la poêle). Versez, juste avant la fin de la cuisson, le lait de coco. Salez, poivrez et rectifiez l’assaisonnement en épices. Mélangez puis servez chaud.",1,1
"Ingrédients sel poivre 1 oignon 3 carottes 1 poulet entier et vidé 500 g de riz 100 g de raisins secs laurier Voir plus Voir moins En cliquant sur les liens, vous pouvez être redirigé vers d’autres pages de notre site, ou sur Amazon.fr La suite après cette publicité Ustensiles 1 Set 3 poêles Notre sélection des meilleures poêles + de détails 1 Râpe Top des meilleures râpes + de détails 1 couteau Top 3 des couteaux + de détails 1 balance de cuisine Top des meilleures balances + de détails En cliquant sur les liens, vous pouvez être redirigé vers d’autres pages de notre site, ou sur Amazon.fr Préparation Temps total : 40 min Préparation : 20 min Repos : - Cuisson : 20 min Étape 1 Mettre le poulet à bouillir avec le laurier. En début de cuisson, des ""déchets"" apparaissent à la surface de l'eau, les enlever à la cuillère. Étape 2 Lorsque le poulet est prêt, le sortir de l'eau et faire cuire le riz dans le bouillon obtenu. Étape 3 Pendant la cuisson, râper les carottes, émincer l'oignon et faire revenir à la poêle, avec beaucoup de beurre si on désire véritablement cuisiner à la russe. Saler et poivrer. Ajouter les raisins secs afin qu'ils se réchauffent. Étape 4 Désosser le poulet, couper la viande en petites lamelles. Étape 5 Lorsque le riz est prêt, y ajouter la viande et la préparation. Servir. A Anonyme Note de l'auteur : « On prépare ce plat en Russie, mais son origine se trouve au Caucase. On peut aussi utiliser de l'agneau voire du boeuf. Dans tous les pays du Caucase, ainsi qu'au Turkménistan, Ouzhbékistan, etc, ce plat est plus ou moins considéré comme un plat national. En Russie, aussi !! » La suite après cette publicité Découvrez l’accord Mets & Vins parfait avec Voir la sélection En partenariat avec Tanin.fr Qu'est-ce qu'on mange ce soir ? De l'inspiration chaque jour avec des recettes faciles, gourmandes et de SAISON :)",1,1
"Ingrédients 1 bouteille d' huile de tournesol pour la friture sel poivre 1 poivron vert 1 oignon 8 oeufs entiers 10 pommes de terre 10 rondelles de chorizo piquant ou non 1 gousse d' ail Voir plus Voir moins En cliquant sur les liens, vous pouvez être redirigé vers d’autres pages de notre site, ou sur Amazon.fr La suite après cette publicité Ustensiles 1 Set 3 poêles Notre sélection des meilleures poêles + de détails 1 pinceau 6,72€ + de détails 1 Couteau Top des meilleurs couteaux de cuisine + de détails 1 économe Top 5 des meilleurs économe + de détails 1 saladier Les meilleures ventes Acheter 1 Écumoire + de détails 1 sauteuse Top 3 des sauteuses + de détails 1 Couvercle Les meilleures ventes Acheter 1 plat + de détails Voir plus Voir moins En cliquant sur les liens, vous pouvez être redirigé vers d’autres pages de notre site, ou sur Amazon.fr Préparation Temps total : 45 min Préparation : 30 min Repos : - Cuisson : 15 min Étape 1 Eplucher et couper les pommes de terre en dés et les faire dorer à feu vif, dans une poêle à bords hauts, avec suffisamment d'huile pour qu'elle recouvre quasiment les dés. Étape 2 Pendant ce temps, éplucher et couper finement l'oignon et le poivron en lanières. Étape 3 Lorsque les dés de pomme de terre commencent à devenir translucides voire un peu colorés, rajoutez les oignons et le poivron. Étape 4 Pendant que ces ingrédients dorent, couper en rondelles le chorizo en prenant le soin d'enlever la peau. Étape 5 Ne rajouter le chorizo dans la poêle que lorsque les pommes de terre sont quasiment prêtes (dorées). Étape 6 L'huile va se colorer, retirer la poêle du feu au bout de 2-3 min. Étape 7 Casser les 8 oeufs dans le saladier et saler abondamment. Étape 8 La technique pour que la tortilla soit DIVINA c'est de goûter l'oeuf, il faut qu'il soit salé et la tortilla sera salée comme il faut. Étape 9 Poivrer et rajouter l'ail haché ou moulu. Étape 10 Là attention à ceux qui ont peur de se brûler : prendre un écumoir et enlever tous les ingrédients de l'huile, égoutter et les mettre dans le saladier avec les oeufs. Étape 11 ""Casser"" les pommes de terre avec l’écumoire dans le saladier. Étape 12 Plus les pommes de terre sont ""cassées"", plus la tortilla sera homogène. Étape 13 Vider l'huile de la poêle (si vous penser en refaire, vider l'huile dans un bocal après l'avoir filtrée, ainsi vous pourrez réutiliser cette huile une prochaine fois). Étape 14 Il doit juste en rester un tout petit peu pour pouvoir faire dorer la tortilla. Étape 15 Verser l'appareil dans la poêle ou sauteuse avec un feu moyen voire doux. Étape 16 Avec une cuillère en bois, aplatir les bords de la tortilla et secouer légèrement la poêle de temps en temps pour s'assurer que ça n'accroche pas. Étape 17 Lorsque l'oeuf du dessus n'est quasiment plus liquide, avec l'aide d'un couvercle plat retourner la tortilla et faire dorer de l'autre côté. Étape 18 Déguster chaude ou froide. e emma_14286623",1,1
"Let’s go en cuisine pour préparer ces verrines avocat saumon fumé et crevettes! Imprimer Épingler la recette 5 de 2 votes Verrines avocat saumon fumé et crevettes Temps de préparation10 minutes min Temps de cuisson0 minutes min Type de plat: Apéritif Mots-clés: avocats, crevettes, mascarpone, saumon fumé Portions: 8 Matériel nécessaireVerrines apéro (12 cl) Ingrédients 1-2 tranches de saumon fumé (selon la taille)2 avocats2 cs de mascarponedes épices à guacamole (ou mexicaines)sel, poivre8 crevettes roses décortiquées InstructionsEmincer les tranches de saumon fumé en petits morceaux et les répartir dans el fond des verrines.Fendre les avocats en deux et retirer le noyau.Prélever la chair avec une cuillère et l'écraser dans une assiette creuse avec une fourchette.Y ajouter le mascarpone, les épices (à doser selon les goûts), saler et poivrer.Bien mélanger et répartir dans les verrines sur le saumon.Déposer une crevette sur chaque verrine.Servir bien frais.",1,1
"Let’s go en cuisine pour préparer ces moelleux poireaux chorizo et raclette! Imprimer Épingler la recette 5 de 1 vote Moelleux poireaux chorizo et raclette Temps de préparation15 minutes min Temps de cuisson40 minutes min Type de plat: Plat principal Mots-clés: chorizo, fromage râpé, moelleux, poireaux, raclette Portions: 6 Matériel nécessaireMoule grands ronds Ingrédients 400 g de poireaux (uniquement les blancs)1 filet d'huile d'olive200 g de lait30 g de beurre75 g de fromage râpé (ici emmental)50 g de vin blanc3 oeufs60 g de farine100 g de chorizo120 g de fromage à raclette InstructionsEmincer les blancs de poireaux et les faire revenir dans une poêle avec l'huile d'olive.Laisser cuire à couvert environ 15 min en ajoutant un peu d'eau (les poireaux doivent être tendres).Préchauffer le four à 200° (chaleur tournante).Dans une casserole, faire chauffer le lait avec le beurre.Ajouter le fromage râpé et mélanger jusqu'à ce qu'il soit fondu.Ajouter le vin blanc.Dans un saladier, fouetter les oeufs et incorporer la farine.Verser le contenu de la casserole et bien mélanger. Saler et poivrer.Dans les empreintes du moule, répartir le chorizo en petits morceaux et la fondue de poireaux.Ajouter le contenu du saladier puis déposer dessus le fromage à raclette en morceaux.Enfourner et laisser cuire 25 min.Servir chaud avec une salade.",1,1
